,회의번호,대수,회의구분,회수,차수,회의연도,안건,발언자,발언순번,sent_raw,sent_id
96,41,1,본회의,제1회,제41차,1948,개의,의사국장 차윤홍,8,"반민족행위처벌법(초안) 제1장 죄 제1조 일본 정부와 통모하여 한일합병에 적극 협력한 자, 한국의 주권을 침해하는 조약 또는 문서에 조인한 자 급 모의한 자는 사형 또는 무기형역에 처하고 그 재산의 전부 혹은 일부를 몰수한다.",1
97,41,1,본회의,제1회,제41차,1948,5. 사면법안,법무부차관 권승열,126,그래서 이 사면법은 대체로 그 주권자에 대한 적용이올시다.,2
98,41,1,본회의,제1회,제41차,1948,5. 사면법안,법무부차관 권승열,126,즉 주권이 인민에게 있는 까닭으로 국회가 주권을 가지고 있고 그 권한행사를 법률로서 대통령에게 위임하는 것입니다.,3
99,41,1,본회의,제1회,제41차,1948,5. 사면법안,법무부차관 권승열,126,"그런데 일본 같은 나라에서는 소위 천황이 대권작용이라고 해서 헌법에 제한하지 않는 것은 일본 천황이 마음대로 하는 것이 있어서, 즉 말하면 자기의 구속 안 받는 자기의 당연한 권한이니까 쓴다고 하지만, 우리 민주주의 국가에서는 즉 주권이 재민(在民)하니까 이것을 위임하지 않으면 즉 사면법만 그대로 있고 다른 것이 없을 것 같으면 행정법규 위반이라든지 징계법 위반이라든지 거기에 의해서 자연히 대통령이 못 하게 됩니다.",4
100,43,1,본회의,제1회,제43차,1948,2. 반민족행위처벌법안,윤재욱 의원,41,그런데 헌법 제4조를 보면 대한민국의 주권은 국민에게 있고 모든 권력은 국민으로부터 발동된다고 했읍니다.,5
101,43,1,본회의,제1회,제43차,1948,2. 반민족행위처벌법안,윤재욱 의원,41,"그러면 이 과거의 감정―전 민중의 감정―을 가지고 논의할 법이 아니라 그분들이 감정을 일소시킬 수 있는 이 법을 제정함으로써 앞으로는 헌법 그대로 전 권력은 전 국민에게 있다, 모든 권력은 국민으로부터 발동된다는 이 공명정대한 정신을 받들어 모든 민족이 이 법으로서의 권력을 발동할 수 있고 주권을 취할 수 있는 이러한 기회를 만들어 주지 않으면 안 된다고 봅니다.",6
102,43,1,본회의,제1회,제43차,1948,2. 반민족행위처벌법안,조국현 의원,42,제1조에 「한국의 주권을 침해하는 조약 또는 문서에 조인한 자」이라는 말이 있읍니다.,7
103,44,1,본회의,제1회,제44차,1948,2. 정부내친일파숙청에관한건,윤병구 의원,35,과거 주권이 우리 손에 운영되었을 때에 대부분 지도자가 얼마의 유식(有識)을 가지지 못하고 사대주의 사상에 추수(追隨)하다가 그대로 내려왔읍니다.,8
104,46,1,본회의,제1회,제46차,1948,2. 반민족행위처벌법안,김익노 의원,33,"제1조에 본다고 할 것 같으면 「일본 정부와 통모하여 한일합병에 적극 협력한 자, 한국의 주권을 침해하는 조약 또는 문서에 조인한 자 급 모의한 자는 사형」 「관공리」 중에 포함시켜 가지고 「직위의 고하를 막론하고 직권을 남용하여 동포에게 가해한 죄적이 현저한 자」 이렇게 규정할 것 같으면 상(上)은 칙임관과 하(下)는 판임관까지라도 해당하리라고 보고 있읍니다.",9
105,46,1,본회의,제1회,제46차,1948,2. 반민족행위처벌법안,서이환 의원,49,"칙임관 이상이라고 하더라도 그 시대의 우리의 정부가 없고 주권이 없고 우리 인민이 자유를 가지지 못한 그 시대에 있어 가지고 우리 동포의 심리가 어떻게 되었느냐 하면, 우리 한인으로서 지사에 임명되었으면 환영을 했으며 일인이면 누구나 꺼렸읍니다.",10
106,48,1,본회의,제1회,제48차,1948,1. 반민족행위처벌법안예비수정안심사에관한보고,신익희 의원,8,만일 적이 시키는 대로 적의 국기를 달고 적의 나라를 저의 나라라고 적의 주권자를 만세를 부르고 적의 모든 가지의 기관으로서 설치되어 있는 데에 많이 순종할 뿐만 아니라 늘 친절하고 친근한 관계를 가졌다고 하는 것이라면 이것을 말하되 민족에게 위반되는 행위라고 하겠고 민족으로서 응당 할 일이라고는 보지 못할 것입니다.,11
107,48,1,본회의,제1회,제48차,1948,3. 반민족행위처벌법안,김웅진 의원,15,"(반민족행위처벌법 축조 낭독)  「제1조 일본 정부와 통모(通謀)하여 한일합병에 적극 협력한 자, 한국의 주권을 침해하는 조약 또는 문서에 조인한 자 급 모의한 자는 사형 또는 무기징역에 처하고 그 재산의 전부 혹은 일부를 몰수한다」",12
108,48,1,본회의,제1회,제48차,1948,3. 반민족행위처벌법안,이남규 의원,65,"왜 그러냐 하면 「일본 정부와 통모하여 한일합병에 적극 협력한 자, 한국의 주권을 침해하는 문서에 조인한 자 급 모의한 자는 사형 또는 무기징역에 처하고 그 재산의 전부 혹은 일부를 몰수한다」 했는데 여기 사형에 해당하는 사람은 벌써 하나님이 다 사형에 부쳐서 아마 지금은 없을 것 같습니다.",13
109,51,1,본회의,제1회,제51차,1948,1. 반민족행위처벌법안,이항발 의원,32,나는 한일병합의 전후를 통하여 조국과 민족의 주권을 보장하기 위하여 비장한 혈투의 역사는 역연합니다.,14
110,52,1,본회의,제1회,제52차,1948,2. 반민족행위처벌법안,김중기 의원,18,그러나 조선의 정기를 바로잡고 국권을 세우기 위해서도 외세에 아부하든 사람을 그대로만 보고 있을 수가 없다는 것을 생각한다는 것이 이 법안에 초점입니다.,15
111,52,1,본회의,제1회,제52차,1948,2. 반민족행위처벌법안,원장길 의원,31,"저는 항상 생각하기를 우리가 조국 광복의 그 정신으로만이 끝까지 우리의 주권을 회복할 수 있을 것이요, 우리의 결정(結晶)을 맺어질 수 있을 것입니다.",16
112,56,1,본회의,제1회,제56차,1948,2. 행정권이양에관한국무위원출석요청의건,이성득 의원,69,"오날은 또 지금 여러분이 이런 반대 의사를 많이 가지셨는데 나는 그렇지 않다고 하는 말을 할 것 같으면, 저놈이 정부에 무슨 추파를 주는 것인가 하는 오해를 혹 가지실는지 모르겠읍니다만은 지금 나와서 말하시는 그분은 우리가 물론 주권을 이양하는 데에 있어서 성심성의로서 급한 것을 생각한다고 할 것 같으면 정부에 있어서도 주권 이양을 받는 그 일에 있어서 이보담 더 급하다고 하는 것을 생각해야 될 것이올시다.",17
113,57,1,본회의,제1회,제57차,1948,3. 행정권이양에관한건,국무총리 이범석,18,"우리가 유감 되게도 우리의 원수를 우리의 역량을 발동해서 분쇄해 버리지 못하고 우리의 주권을 이 나라에서 창조하지 못하고 결국 남에게서부터 소위 「카이로」 선언으로 상당한 시기라는 여기에 해당하는 전체를 이양받는 데에, 그러나 이양을 해 주는 것은 주체성적 입장에 있는 것입니다.",18
114,57,1,본회의,제1회,제57차,1948,3. 행정권이양에관한건,국무총리 이범석,18,결코 이것은 주저 넘은 말인지는 모르겠으나 이 사람이 이 나라에 주권을 찾고 거기에 최대한 노력으로서 이 몸을 바칠 것밖에 아무것도 없읍니다.,19
115,57,1,본회의,제1회,제57차,1948,3. 행정권이양에관한건,이문원 의원,28,"이러한 점으로서 어느 정도 안심이 되나 우리는 항상 잊을 수 없는 것은 독립운동이요, 또는 지금 국권이 아직 완전히 회복이 되지 못한 이때인 만큼 국민의 여론을 총집중해서 다소간에 거기에 효과를 100%로 발휘하는 데에 우리 본의가 있었기 때문에 우리는 그리 생각을 한 것입니다.",20
116,57,1,본회의,제1회,제57차,1948,3. 행정권이양에관한건,이문원 의원,28,그러기 때문에 정부로서도 아무리 자신이 있다 할지라도 만일 여하한 형편이 있든지 또는 여론이 필요하다든지 그러한 점으로 보아서 우리는 반다시 우리로서 정부를 협력하며 우리 국권 회복하는 데 도웁기 위해서 우리가 여론을 정당하게 환기하여야 될 것입니다.,21
117,59,1,본회의,제1회,제59차,1948,"2. 반민족행위처벌법안 제2, 3독회",부의장 김약수,59,"(김웅진 의원 「반민족행위처벌법」 축조낭독) 「반민족행위처벌법」 목 록 「제1장 죄 제2장 특별조사위원회 제3장 특별재판부구성 급 수속 부 칙반민족행위처벌법 제1장 죄 제1조 일본 정부와 통모하여 한일합병에 적극 협력한 자, 한국의 주권을 침해하는 조약 또는 문서에 조인한 자 급 모의한 자는 사형 또는 무기징역에 처하고 그 재산 급 유산의 전부 혹은 2분지 1 이상을 몰수한다」 (「이의 없읍니다」 하는 이 있음) 「제2조 일본 정부로부터 작을 수한 자 또는 일본 제국의회의 의원이 되었든 자는 무기 또는 5개년 이상의 징역에 처하고 그 재산 급 유산의 전부 혹은 2분지 1 이상을 몰수한다」 (「이의 없읍니다」 하는 이 있음) 「제3조 일본 치하 독립운동자나 그 가족을 악의로 살상 박해한 자 또는 이를 지휘한 자는 사형 무기 또는 5개년 이상의 징역에 처하고 그 재산의 전부 혹은 일부를 몰수한다」 (「이의 없읍니다」 하는 이 있음) 「제4조 좌의 각호의 1에 해당하는 자는 10년 이하의 징역에 처하거나 15년 이하의 공민권을 정지하고 그 재산의 전부 혹은 일부를 몰수할 수 있다.",22
118,60,1,본회의,제1회,제60차,1948,3. 연호문제에관한건 ,최운교 의원,56,"이 사실문제라고 하는 그것은, 즉 지금부터 기미년 3월 1일 날 이 나라의 우리 민족의 국권을 박탈당해 가지고서 우리나라 3천만이 33인의 민족대표로서 독립선언서를 내며 따라서 독립정부를 세웠던 것입니다.",23
119,60,1,본회의,제1회,제60차,1948,3. 연호문제에관한건 ,조국현 의원,59,"여러분, 우리나라에는 이와 달라서 주권을 하로라도 비지 아니하였읍니다.",24
120,61,1,본회의,제1회,제61차,1948,3. 국가와국기제정에관한건의안,정균식 의원,54,"물론 여러분이 잘 아시는 바와 같이 국가에는, 온 나라에는 국토와 국민과 주권에 대한 어떠한 표상이 있읍니다.",25
121,61,1,본회의,제1회,제61차,1948,3. 국가와국기제정에관한건의안,정균식 의원,54,"국호로 말할진대 혹 칭호나 명사의 표상이고 하며 국가 국기 이것은, 국기는 혹 부대적 표상이라고도 할 수 있을 것이며, 나라의 노래는 국가에 있어서 언사적(言事的) 내지 정신적 문화예술 방면을 통한 국토와 국민과 주권에 대한 이런 표상이라고 볼 수 있는 것입니다.",26
122,61,1,본회의,제1회,제61차,1948,3. 국가와국기제정에관한건의안,정균식 의원,54,이 애국가의 발족도 여러분께서는 아실 것입니다마는 전날에 우리 애국청년으로서 우리 독립을 얻으려 할 때에 주권을 차지려 할 때에 독립사상을 고취시키고 우리의 민족의식을 진작시키기 위해서 나라를 사랑하며 주권을 그리워하고 함으로써 애달픈 이런 가사로서 지어 놓은 것입니다.,27
123,61,1,본회의,제1회,제61차,1948,3. 국가와국기제정에관한건의안,정균식 의원,54,그것은 좀 아까 말씀한 우리 국토와 국민과 주권이 있음에 예술적으로 완성해야겠다고 하는 데서 곡조에 있어서는 특별히 다른 데에서 구해서 외국 사람의 곡조라도 좋을 것입니다.,28
125,64,1,본회의,제1회,제64차,1948,2. 대한민국정부급미국정부간의재정급재산에대한최초의협정안비준에관한동의의건,이강우 의원,72,아까 총리께서 설명하시기를 국회의 승인을 받는 차제로  국권이 발동된다고 하는 이런 말씀이 계셨읍니다.,29
126,64,1,본회의,제1회,제64차,1948,2. 대한민국정부급미국정부간의재정급재산에대한최초의협정안비준에관한동의의건,이강우 의원,72,우리는 물론 종이만 있다고 하면 이양이 되고 국권이 발동되리라고 하는 것을 믿었든 바인데 국회의 승인은 차제로서 한 시간이라도 속히 된다고 하면 속히 국권이 발동되리라고 하는 그런 말씀이 계셨읍니다.,30
127,64,1,본회의,제1회,제64차,1948,2. 대한민국정부급미국정부간의재정급재산에대한최초의협정안비준에관한동의의건,이강우 의원,72,아까 총리께서 그러한 말씀이 계셨으니까 우리는 그 내용에 있어서 가령 불만한 조건이 있다 하드라도 시간에 따라서 국권 발동이 발생된다는 그러한 말씀에 의지해서 우리는 무조건하고 승인하야 주기를 동의합니다.,31
128,64,1,본회의,제1회,제64차,1948,2. 대한민국정부급미국정부간의재정급재산에대한최초의협정안비준에관한동의의건,박해극 의원,76,"그러므로 본인의 생각에는 오늘날 이러한 것을 국가에서 정부에 관한 것을 불과 200명의 국회가 책임을 지지만 국회의원이라는 것은 적어도 삼천만 민중, 우리 주권자 된 삼천만 민중에 대해서 책임을 지고 있읍니다.",32
129,64,1,본회의,제1회,제64차,1948,2. 대한민국정부급미국정부간의재정급재산에대한최초의협정안비준에관한동의의건,김명동 의원,81,"지금 여러분께서 말씀하셨는데 오후 전원회의를 열자, 이틀만 하자, 사흘만 하자는 등 그런 말을 하는 분이 있읍니다마는 우리는 이 문제가 신중을 기하여야 하는 만큼 우리가 하로속히 인준해서 하로라도 속히 국권을 찾자고 하는 것입니다.",33
130,64,1,본회의,제1회,제64차,1948,2. 대한민국정부급미국정부간의재정급재산에대한최초의협정안비준에관한동의의건,김명동 의원,81,그러나 우리는 국권을 찾는 데 있어서는 완전한 국권을 찾지 않으면 안 됩니다.,34
131,64,1,본회의,제1회,제64차,1948,2. 대한민국정부급미국정부간의재정급재산에대한최초의협정안비준에관한동의의건,김동원 의원,100,이 일에 대해서는 우리가 먼저 생각할 것은 무엇이냐 하면 미국으로서 막대한 금전을 얻게 되니까 그로 말미아마 우리 상대 국가의 소위 주권에 다소 무슨 저희(沮戱)를 받지 않을가 하는 그것을 검토할 뿐이올시다.,35
132,64,1,본회의,제1회,제64차,1948,2. 대한민국정부급미국정부간의재정급재산에대한최초의협정안비준에관한동의의건,김동원 의원,100,미국에 관계되는 일인 만큼 우리가 거기에 대해서 신중을 기할 것은 무엇인고 하면 미국보다도 더 잘 우리를 도와주는 국가가 있을지라도 우리가 금후 주권에 대해서 어떠한 지장이 오는가 하는 거기에 중점을 두어 가지고 우리가 다소 검토할 것뿐인 줄 압니다.,36
133,64,1,본회의,제1회,제64차,1948,2. 대한민국정부급미국정부간의재정급재산에대한최초의협정안비준에관한동의의건,김동원 의원,100,"그러나 이제 어떤 분이 말씀한 바와 같이 만일 거기에 평가를 해서 오산(誤算)이 되어서 시가평가를 하지 않고 과대한 평가를 해서 어떠한 것이 너무 많다고 한다든지 이와 같이 한다고 할 것 같으면 우리가 5억 불을 얻는 것을 10억 불 20억 불을 얻는다는 것은 도무지 자미가 없으니까 만일 평가가 정당하냐 또는 모든 출발점이 정당하냐, 결국은 우리가 이러한 일을 함으로서 금후 우호국가 미국에 대해서 미국이 다소 우리의 주권에 간섭할 점이 있지 않을까 하는 그런 것을 엿보고 검토할 것, 그 외에 다소 우리가 절대한 신탁을 하지 않는다고 할지라도 정부 당국에 맡겨 드리고 이 몇 가지 점에 검토하는 데에 있는 줄로 생각합니다.",37
134,69,1,본회의,제1회,제69차,1948,1. 대한민국정부급미국정부간의재정급재산에관한최초협정동의의건,이항발 의원,2,그 국정 이양을 하로빨리 우리 대한민국 정부에다가 이양하고 또는 우리 민족이 간원(懇願)하는 그 주권을 하로빨리 우리 대한민국에 우리 주권을 부여하기 위한다는 성의에서 나온 협정이라고 봅니다.,38
135,69,1,본회의,제1회,제69차,1948,1. 대한민국정부급미국정부간의재정급재산에관한최초협정동의의건,이항발 의원,2,"그러므로 본인의 생각에는 우리의 우방인 우리의 은혜로운 미국이 국제적으로 우리 약소민족의 주권을 위하고 자유 민족을 만들기 위해서 노력해 왔던 그것과, 따라서 국내 모든 착잡 혼란한 현상을 하로빨리 수습하기 위해서 우리 대한민국의 그 주권을 주었다는 점에 대해서는 우리로서는 성의로서 그에 감사의 뜻을 표시하지 않으면 안 될 줄 압니다.",39
136,69,1,본회의,제1회,제69차,1948,1. 대한민국정부급미국정부간의재정급재산에관한최초협정동의의건,이항발 의원,2,"하나는 우리는 제1차대전을 통해서 보고 또 제2차대전을 하는 동안 우리는 전쟁의 가장 중요한 원인이 어데 있느냐, 각 민족 각 국가가 자기 주권을 침해받지 아니하기 위해서 전쟁을 했다고 볼 수 있읍니다.",40
137,69,1,본회의,제1회,제69차,1948,1. 대한민국정부급미국정부간의재정급재산에관한최초협정동의의건,이항발 의원,2,이 전쟁에서 각 민족 각 국가의 주권이라든지 이것을 보장하고 그 민족이 가지고 있는 영토를 침해받지 않기 위해서 나타난 전쟁이라고 생각할 수 있읍니다.,41
138,69,1,본회의,제1회,제69차,1948,1. 대한민국정부급미국정부간의재정급재산에관한최초협정동의의건,신현돈 의원,32,그러나 실지 문제에 있어서 앞으로 국권을 가지고 우리 국회 내지 우리 정부가 과연 공정하고 양심적으로 미국 정부와 협약을 할 수 있느냐 없느냐 하는 것은 우리 주권에 달린 것이지 이 문구 기본 여하로서 중대한 문제를 좌우될 것이 아니라고 나는 확실히 지적합니다.,42
139,69,1,본회의,제1회,제69차,1948,1. 대한민국정부급미국정부간의재정급재산에관한최초협정동의의건,신현돈 의원,32,이렇게 볼진데 저 의원은 모든 것을 선의로만 해석하고 또 모든 문구의 불평을 말살한다고 하는 그러한 오해를 가지실 줄 모르지만 우리가 냉정히 비판할 때에 우리가 현실 문제에 들어가서 20년 후 10년 이후 운운하는 것은 너무 우리의 주권과 우리의 권리와 우리의 국가의 주권을 부인하고 하는 말이 아닌가 나는 생각합니다.,43
140,69,1,본회의,제1회,제69차,1948,1. 대한민국정부급미국정부간의재정급재산에관한최초협정동의의건,신현돈 의원,32,"그러고 대체 어제 공기 가운데에서 부득이 우리의 국권을 찾기 위해서 여러 가지 정세로 봐서 우리가 이것을 승인한다, 아까 권 의원의 말씀과 마찬가지로 눈을 감는다든지 백지라든지 혹은 무조건으로 이것을 승인한다는 것은 그러한 말은 도저히 성립될 수 없는 것입니다.",44
141,69,1,본회의,제1회,제69차,1948,1. 대한민국정부급미국정부간의재정급재산에관한최초협정동의의건,신현돈 의원,32,그런 고로 본 의원의 주장은 이제 서로 금액을 인수하는 또는 국권을 갖지 못한 우리가 국권을 인수하는 이 마당에서 이 금액 가운데에 우호적 혹은 호의적으로 조약된 이 조건인 까닭에 나는 이것을 우리가 도장을 찍고 승인한다 할지라도 내 마음에는 해석이 잘못될는지 모르지만 그다지 큰 과오가 없다는 것을 나는 생각합니다.,45
142,69,1,본회의,제1회,제69차,1948,1. 대한민국정부급미국정부간의재정급재산에관한최초협정동의의건,육홍균 의원,37,"우리가 독립한다는 것은 우리의 자주권을 찾기 위한 것인데 조금 시일이 지연된다고 해서 우리의 자주권이 상실되는 것 같은 감이 혹은 우리 독립권에 침해되는 것 같은 어떠한 문구가 있다고 하면 이것은 어데까지든지 우리가 규명해 놓고 처리해야 되지, 만약에 그렇지 않고 시급하다 혹은 미국은 우리를 원조하는 나라이니까 추호라도 그 나라의 의도를 의심할 필요가 없다고 해서 어물어물하는 것은 장래에 우리가 반드시 큰 과오를 남겨 놓는 결과가 되리라고 생각합니다.",46
143,69,1,본회의,제1회,제69차,1948,1. 대한민국정부급미국정부간의재정급재산에관한최초협정동의의건,내무부장관 윤치영,39,전시 적국에 대해서 점령지대에 있는 신생국가에 대해서 주권을 찾을려고 정권 이양에 대한 점령군 사령관과 현 정부를 구성한 법적 승인을 맡은 것입니다.,47
144,69,1,본회의,제1회,제69차,1948,1. 대한민국정부급미국정부간의재정급재산에관한최초협정동의의건,내무부장관 윤치영,39,"그러므로 첫째, 국제조약은 그 재료에 있어서 먼저 그 제출하는 그 조문이 평등 우호 자유 주권을 존중하는 조약인가 아닌가 살피는 데 있어서 신생국가를 찾은 우리 대표자로서 이 조문을 승인하는 것이 조금도 어그러진 것이 없다고 생각해서 조문에 승인했던 것입니다.",48
145,69,1,본회의,제1회,제69차,1948,1. 대한민국정부급미국정부간의재정급재산에관한최초협정동의의건,내무부장관 윤치영,39,여러분 다 아시는 바와 마찬가지로 9월 21일이라는 것이 앞으로 5일밖에 남아 있지 않은데 9월 21일에 마땅히 순서대로 국제연합 총회에서 우리의 문제를 토의한다 하지만 아직 우리에게 법리적 정권 이양을 받지 못했으며 우리는 대표로서 완전히 주권을 대표할 수가 없읍니다.,49
146,69,1,본회의,제1회,제69차,1948,1. 대한민국정부급미국정부간의재정급재산에관한최초협정동의의건,내무부장관 윤치영,39,하므로 제가 긴 말씀 하지 않고 큰 과오가 있는 것처럼 말씀하시는 것은 조금 지나친 것이고 또 한 가지는 이 문제가 앞으로 21일 이후에 곧 발표가 돼서 완전한 주권국가로 행세해야 될 것인데 국회에서는 여기에 대해서 어떻게 결말을 지을지 잘 아실 줄 압니다.,50
147,69,1,본회의,제1회,제69차,1948,1. 대한민국정부급미국정부간의재정급재산에관한최초협정동의의건,내무부장관 윤치영,39,헬믹 소장의 편지와 같이 외국 대사나 공사나 우리에게 와서 중요한 것을 요구하면 양보한다든지 이것은 조금도 주권의 침해가 아니 되는 것입니다.,51
148,69,1,본회의,제1회,제69차,1948,1. 대한민국정부급미국정부간의재정급재산에관한최초협정동의의건,대통령 이승만,46,지금 잊어버린 국권을 회복해서 정부를 세워 가지고 우리 다시 남선(南鮮)이나마 먼저 해 가지고 이 주권을 하루바삐 찾어야 되겠다고 하는 것이 우리의 제일 중요한 문제라고 생각하고 여러분도 다 아시고 동포가 다 각오하는 바입니다.,52
149,69,1,본회의,제1회,제69차,1948,1. 대한민국정부급미국정부간의재정급재산에관한최초협정동의의건,대통령 이승만,46,미국 사람들이 남의 나라에는 도와주지 않고 우리나라에만 도와주는 것이 아니라 구라파 각국에 있어서의 곡식과 물자를 가지고 도와주는 것과 같이 우리나라도 예전부터 도와주었지마는 아직 주권을 받지 못했으므로 주권을 받은 지금에 와서 이 기회에 도와주자고 작정한 것입니다.,53
150,69,1,본회의,제1회,제69차,1948,1. 대한민국정부급미국정부간의재정급재산에관한최초협정동의의건,장홍염 의원,50,만약 근본 협정이 국민 전체의 의사에 조금이라도 불합당하고 우리의 주권을 침해하려는 점이 있다면 어찌하겠읍니까?,54
151,69,1,본회의,제1회,제69차,1948,1. 대한민국정부급미국정부간의재정급재산에관한최초협정동의의건,장홍염 의원,50,무체라면 이것이 곧 말하면 주권을 침해하는 무언의 진언(進言)이라고 단언합니다.,55
152,69,1,본회의,제1회,제69차,1948,1. 대한민국정부급미국정부간의재정급재산에관한최초협정동의의건,신성균 의원,53,그러나 우리가 정치적으로 이 문제를 해결할려고 할 때에 만일 주권을 찾지 않고 만다면 모르지만 누구든지 여기 모인 우리 동지들은 합법적으로 주권을 한번 회복하자는 데까지는 별 이의가 없을 것입니다.,56
