,회의번호,대수,회의구분,회수,차수,회의연도,안건,발언자,발언순번,sent_raw,sent_id
590,720,2,본회의,제12회,제74차,1952,3. 대통령 임기에 관한 건,서이환 의원,27,"주권을 세우기 위하여 국회의원 선거법이라는 것을 입법의원 때에 제정했고 그 법률에 의하여 국회의원의 선거를 하고, 국가는 없지만 국회의원이라 했으니까 그것은 불원한 장래에 건설되고 수립될 그 국가를 상정하므로서 국회의원이라고 하는 이름을 미리 부쳤든 것입니다.",465
591,720,2,본회의,제12회,제74차,1952,3. 대통령 임기에 관한 건,서이환 의원,27,주권을 세우기 위하여 선거 하도록 한 것이에요.,466
592,720,2,본회의,제12회,제74차,1952,3. 대통령 임기에 관한 건,서이환 의원,27,우리네가 만일 유엔에 아무런 관련성이 없이 우리 자력으로 무력혁명을 하였다든지 기타 어떠한 방식의 혁명을 일으켰다든지 해 가지고 이때까지 침략하고 있든 대상자들을 물리치고 우리 주권을 발동해 나갔다고 할 것 같으면 취임식하는 그 순간부터 우리 주권이 발생된 것입니다.,467
593,720,2,본회의,제12회,제74차,1952,3. 대통령 임기에 관한 건,서이환 의원,27,정치 도의에 입각해서 주권국가를 만들어 줄 테니 주권국가가 될 여러 가지 형태를 갖추라 해서 그 형태를 갖추기 위해서 헌법을 제정하고 대통령을 선거했고 정부조직법도 동시에 통과시켰고 그 법률에 의해서 우리가 정부를 조직하는 공작을 하였다는 것입니다.,468
594,720,2,본회의,제12회,제74차,1952,3. 대통령 임기에 관한 건,김봉조 의원,31,8월 15일 오전 0시를 기해서 그 당시의 군정책임자 하지 중장은 이제부터 군정 밑에 있든 대한민국 주권을 대한민국에 넘긴다는 선언이 있었읍니다.,469
595,720,2,본회의,제12회,제74차,1952,3. 대통령 임기에 관한 건,김봉조 의원,31,이 군정법령으로서 5․10선거가 소집이 되어 가지고 거기에 제정된 헌법이 어떻게 그때에 군정의 주권자가 방해로 나오지 않을가 해서 어떻게든지 빨리 주권을 이양을 받자고 해서 어떻게든지 국회의장으로 해도 별일이 없겠지 해서 한 것으로 그렇게 들었습니다.,470
596,720,2,본회의,제12회,제74차,1952,3. 대통령 임기에 관한 건,김봉조 의원,31,"아까 소선규 의원이 말씀했읍니다마는 한 나라가 독립국가로서 승인되는 요건이 국제공법에서 볼 것 같으면 그 나라에 국민이 있어야 되고 영토가 있어야 되고 주권 행사, 주권이 있어야…… 세 가지 요소가 요건이 되지 않을 때에는 독립정부로서 승인이 안 되는 것입니다.",471
597,720,2,본회의,제12회,제74차,1952,3. 대통령 임기에 관한 건,김봉조 의원,31,국민이 있고 영토가 있고 주권이 있었읍니다.,472
598,720,2,본회의,제12회,제74차,1952,3. 대통령 임기에 관한 건,김봉조 의원,31,주권은 군정에서부터 대한민국에 넘겨준다 그렇게 되어 가지고 이 박사는 그날로부터 인계를 했다 말이에요.,473
599,720,2,본회의,제12회,제74차,1952,3. 대통령 임기에 관한 건,김봉조 의원,31,"대한민국 대통령으로서 대한민국을 대표해서 그래 가지고 그날부터 시방 주권을 행사하기 시작했으니까 대통령이…… 아까 이재형 의원이 말씀했읍니다마는 소위 선거로부터 나와서 4년이나 5년 집권 못 할 그러한 일이 있을 수 있으니까 실제로 대통령이 대통령으로서 권한을 행사한 날은 8월 15일, 법적으로 말할 것 같으면 취임식 훨씬 뒤의 8월 15일 0시 12시부터라고 이렇게 생각이 됩니다.",474
600,720,2,본회의,제12회,제74차,1952,3. 대통령 임기에 관한 건,김봉조 의원,31,8월 15일 그것을 주장할 것 같으면 그것은 어느 날이든지 주권이 자기에게 올 것 같으면 주권을 행할 준비태세라고 해석할 수밖에 없읍니다.,475
601,720,2,본회의,제12회,제74차,1952,3. 대통령 임기에 관한 건,박만원 의원,33,둘째는 대통령으로서의 모든 주권을 행사하는 그 주권 내용 자체가 완전무결해야만 처음으로 대통령으로서의 자격이 있다고 이렇게 생각하시는 모냥인데 이 점에 대해서도 저는 이의를 가지는 것입니다.,476
602,720,2,본회의,제12회,제74차,1952,3. 대통령 임기에 관한 건,박만원 의원,33,주권행사에 있어서 그 일부에 있어서 불완전성이 있다고 하드라도 역시 헌법이 존재해 있고 헌법 밑에서 선거된 대통령이 취임한 이상에 있어서는 대통령 자신은 대통령입니다.,477
603,720,2,본회의,제12회,제74차,1952,3. 대통령 임기에 관한 건,박만원 의원,33,"왜 그러냐 하면 실례를 들어서 말씀한다면 가령 망명해 있든 우리 임시정부가 수립이 되어서 정치적 목적을 달성하지 못하고 주권을 회복하지 못하고 해외에서 풍설노숙(風雪露宿)하고 있는 기간이 10년이 되었거나 20년이 되었다고 가정하드라도 그 임시정부를 수립하는 데 있어서 헌법을 제정했다, 그 헌법에는 대통령 임기가 몇 해로 되어 있다, 4년이면 4년으로 되어 있다 이러한 경우를 가상해 본다면 지금 말씀하신 그런 논리를 전개한다면 그 임시정부의 대통령 자체는 헌법에 임기가 4년으로 되어 있다고 하드라도 임기만료라는 것은 존재할 수 없고 한번 당선된 대통령만이 20년 30년 그대로 있어야 한다는 결론밖에 나지 않을 것입니다.",478
604,720,2,본회의,제12회,제74차,1952,3. 대통령 임기에 관한 건,장택상 의원,35,대한민국이 주권국가로 비로소 발족하기를 8월 15일 날부터 했어요.,479
605,720,2,본회의,제12회,제74차,1952,3. 대통령 임기에 관한 건,장택상 의원,35,대한민국 주권이 세계만방의 승인을 얻어 가지고 비로소 주권국가로 발족된 것이 8월 15일이에요.,480
606,720,2,본회의,제12회,제74차,1952,3. 대통령 임기에 관한 건,노기용 의원,37,왜 그러냐 하면 민주주의는 즉 주권이 국민에게 있다는 것입니다.,481
607,720,2,본회의,제12회,제74차,1952,3. 대통령 임기에 관한 건,노기용 의원,37,그렇다며는 대한민국은 8․15 해방을 통해서 민주주의 원칙에 의지해서 대한민국은 이미 영토가 있었고 이미 국민이 있었고 또 이미 국민으로서 민주주의 원칙에 의지해서 주권을 이미 갖추었읍니다.,482
608,720,2,본회의,제12회,제74차,1952,3. 대통령 임기에 관한 건,노기용 의원,37,그러나 아직까지 자주적 주권을 행사할 수 없어서 역시 미 군정이 그 주권을 보호 육성하는 기간이 약 3년 걸린 것 같습니다.,483
609,720,2,본회의,제12회,제74차,1952,3. 대통령 임기에 관한 건,노기용 의원,37,그동안에 여러 가지로 준비해서 대한민국 국민으로서 의회를 구성하기 위해서 선거하는 그 시간이 즉 대한민국의 주권이 발동되는 시간이라는 것은 타당할 것이올시다.,484
610,720,2,본회의,제12회,제74차,1952,3. 대통령 임기에 관한 건,노기용 의원,37,즉 대한민국 국민이 주권행사를 했다 이것입니다.,485
611,720,2,본회의,제12회,제74차,1952,3. 대통령 임기에 관한 건,노기용 의원,37,주권행사를 했으니 대한민국의 주권은 선거를 통해서 발동된 것이 당연한 사실입니다.,486
612,720,2,본회의,제12회,제74차,1952,3. 대통령 임기에 관한 건,노기용 의원,37,그러면 이미 주권이 발동된 나라에 있어서 대통령을 선거했는데 대통령의 임기가 어느 날이냐…… 이것은 이미 주권이 발동되어서 선거를 한 이상 대통령 임기문제라는 것은 자기가 취임하는 날이 당연히 임기가 되는 것이올시다.,487
613,720,2,본회의,제12회,제74차,1952,3. 대통령 임기에 관한 건,노기용 의원,37,사람에 있어서 한 권리를 주장할 때에 20세가 법적 권리의 성년이라고 가정한다고 할지라도…… 역시 법적으로 성년이 되지 않을지라도 그 부모 친척이 여러 가지 협조하고 원조해서 그 주권이 완전히 행사하도록 해 주면 될 것입니다.,488
614,720,2,본회의,제12회,제74차,1952,3. 대통령 임기에 관한 건,노기용 의원,37,"대통령이 이미 취임을 했을진데…… 말하자면 그 과거의 여러 가지 사무를 인계한다든지 혹은 여러 가지를 인계 않는다든지 이것은 그때의 사정에 대한 한 조처…… 그런 정치적 여러 가지 사정일 것이요, 법적 근거에 의지해서는 취임하는 날이 당연히 주권을 행사하는 날이라고 하는 말이 당연할 것입니다.",489
615,720,2,본회의,제12회,제74차,1952,3. 대통령 임기에 관한 건,노기용 의원,37,그렇다고 주권이 없는 게 아닙니다.,490
616,720,2,본회의,제12회,제74차,1952,3. 대통령 임기에 관한 건,노기용 의원,37,그렇다고 하며는 역시 대한민국의 주권은 민주주의 원칙에 의지해서 8․15 해방 이후에 곧 영토와 인민과 주권이 생겼고 육성기간이 한 3년…… 그리고 주권행사는 선거를 하는 그날이 주권행사야요.,491
617,721,2,본회의,제12회,제75차,1952,2. 대통령 임기에 관한 건,정남국 의원,6,그동안 여러 가지 사정이 불비해서 사무인계를 8월 15일에 받었다고 해서 그날 후에야 주권이 발동되고 임기가 된다는 것은 우리가 여태까지 우리 자체를 스스로 모욕하는 말같이도 인식이 되요.,492
618,721,2,본회의,제12회,제75차,1952,2. 대통령 임기에 관한 건,조봉암 의원,10,"주권이 왜제국주의(倭帝國主義)로 말미암아서 박탈당했다, 우리가 3․1운동 전후에 민의에 의해서 대한민국을 건설해서 우리가 주권을 회복하는 노력을 계속해 왔다, 이제 오늘날 우리가 이 주권을 회복하는 날이다 그것이 명시되고 있는 것입니다.",493
619,721,2,본회의,제12회,제75차,1952,2. 대통령 임기에 관한 건,조봉암 의원,10,"남에 의해서가 아니고 우리 스스로가 노력을 했다, 오늘날 비로소 인민의 대표로서 선거된 국민의 대표가 헌법을 제정해서 선포하고 거기에 따라서 우리 대통령을 선거하게 되고 정부를 조직하는 것이고 이것을 이렇게 해서 이 주권을 확립하는 날이다 그러한 것을 전문에 기록한 것입니다.",494
620,721,2,본회의,제12회,제75차,1952,2. 대통령 임기에 관한 건,조봉암 의원,10,그런데 여기서 어려운 법률적 문제가 생겨서 가령 말하자면 국토 인민 주권 또 혹은 대통령으로서의 권리행사 이러한 것을 말합니다.,495
621,721,2,본회의,제12회,제75차,1952,2. 대통령 임기에 관한 건,조봉암 의원,10,우리가 중요하게 논란된 가운데에서 어제부터 토론이 되어 독립국가라는 것은 주권이 있어야 된다는 것을 강조한 분이 몇 분이 있읍니다.,496
622,721,2,본회의,제12회,제75차,1952,2. 대통령 임기에 관한 건,조봉암 의원,10,국가와 인민과 주권 이 세 가지가 구비되어야만 비로소 그것이 국가이니까 이런 의미에 있어서 이 세 가지가 완비된 것을 우리가 고려해야 된다 이런 의미로서 8․15가 법리적으로 성립될 수 있다고 주장하시는 것입니다.,497
623,721,2,본회의,제12회,제75차,1952,2. 대통령 임기에 관한 건,조봉암 의원,10,서울을 내놓고 얼마 안 되는 데에 있었다고 해서 우리 주권이 없는 것이고 대한민국이 완전하지 아니하고 대통령이 완전한 대통령이 아니라는 논고가 설 것입니까?,498
624,729,2,본회의,제12회,제83차,1952,1. 헌법개정안,법무부차관 정재환,7,대통령 부통령 직접선거제도의 채택  국민주권을 근본원칙으로 하는 민주국가에 있어서는 모든 공무원은 주권자인 국민의 공복이며 언제든지 국민에 대하여 책임을 지는 것입니다.,499
625,729,2,본회의,제12회,제83차,1952,1. 헌법개정안,법무부차관 정재환,7,"대통령 역시 공무원의 한 사람일 뿐만 아니라 행정부의 수반이며 국가를 대표하는 중책을 가지는 것이므로 다른 공무원보다 일층 더 주권자인 국민의 의사가 그에게 직접적으로 반영, 침투되어야 할 것이며 부통령 역시 그러하여야 할 것입니다.",500
626,731,2,본회의,제12회,제85차,1952,1. 헌법개정안,이종현 의원,12,"대통령 직선제 해서 주권재민이라는 그대로 실현시켜 주고, 상하 양원제 해서 아까 조주영 국무위원이 설명하신 바와 같이 단원제 독단의 폐해도 막어 주고, 신중하게도 하고, 거기다가 금상첨화로 내각책임제까지 하여 인사 잘못하는 것을 고치도록 해 놓으면 얼마나 좋겠에요.",501
628,757,2,본회의,제13회,제23차,1952,5. 국무위원 출석요청에 관한 긴급동의,박정근 의원,63,"신문지상에서 급차(級此)에 보고 알고 있는 바와 같이 작금에 그 기관은 본격적으로 발동해 가지고 대한민국의 모든 경제의 주권이라고 말하면 어폐가 있을 것 같읍니다마는 실권을 그 위원회가 쥐다싶이 해 가지고 물가의 결정까지 모든 것을 거기서 하고 이제 들은 정보에 의하면 최근 비료값 같은 것도 한국 정부가 작정할 필요가 없다, 우리가 작정해야 된다고 그 위원회가 먼저 작정한다고 얘기를 들었습니다.",502
629,763,2,본회의,제13회,제29차,1952,개의,윤치영 의원,8,그러나 만일 우리로서 대외적으로 원조를 청하려 할 때 먼저 우리로서 원조해 달라고 요구하기 전에 우리 스스로의 정부조직 우리의 모든 행정기구에 대한 것을 단일화해 가지고 우리 스스로 주권적 행동을 잘 해 나가야만 잘 원조 받을 수 있는 것이 원칙이라는 것도 나 스스로 시간상 관계로 이에 대해서 더 여기서 말씀하려 하지 않습니다.,503
630,776,2,본회의,제14회,제11차,1952,1. 국무원 불신임에 관한 결의안,윤치영 의원,4,우리 대한민국 수립 후 제1의 4년을 지내고 제2의 4년이 시작되는 이 마당에 있어서 우리는 민의에 의해서 525만 표라는 직선으로 국민이 투표한 우리 주권자 되는 대통령을 모시게 되었읍니다.,504
631,776,2,본회의,제14회,제11차,1952,1. 국무원 불신임에 관한 결의안,윤치영 의원,4,여러분 다 아시는 바와 마찬가지로 미국의 공화당 민주당이 서로 싸워서 미국 주권에 대한 정권을 쟁탈하는 데 있어서 한국에 대한 그 정책을 근본적으로 누가 되느냐를 결정짓는 문제로 하여 싸워서 오는 4일 투표하는 이 마당에 있어서 여러분은 미국 국민이 이것을 어떻게 중요시하고 있다는 것을 새삼스럽게 인식하실 줄 믿습니다.,505
632,776,2,본회의,제14회,제11차,1952,1. 국무원 불신임에 관한 결의안,윤치영 의원,4,"그러므로 대단히 미안한 말씀이지만 내가 당돌히 의원으로서 동지적 입장에서 여러분에게 말씀드리고저 하는 것은 우리 스스로 위신을 세우고 우리 스스로 본분을 지키고 이 불상한 국민 앞에 또 대한민국의 주권자 되는 대통령에게 우리 스스로 우리 임무를 다하는 의미에서 가진 거짓말, 간사한 그 농간을 배제하고 국민 앞에 정제를 나타내게 하는 것이 오늘 여러분이 가지고 있는 그 본분이라고 믿기 때문에 여러분 오늘 우리가 작정하는 것은 감정적으로 정부에 대한 투표를 하는 것이 아니요 여기에 우리가 어떠한 신문지상에 있는 바와 같이 전에 얻어맞은 것을 복수하기 위하여 투표하는 것이 아니라 국제적으로 국내적으로 국민을 대표하는 입법부는 행정부의 잘못을 바로 잡고 우리 스스로 입법부에 잘못이 있다고 할 것 같으면 우리 스스로 시정할 능력이 있다는 것을 발휘하는 이 마당에 있기 때문에 우리는 대통령의 주위에서 민의 아닌 민의를 거짓말해 가지고 우리를 불행에 빠지게 하는 그 사실을 지적하는 입장에 있다고 보기 때문에 나 스스로 여러분에게 길게 말씀하지 않고 오늘 결정하는 이것이 우리 자손만대에 전해 줄 성스러운 사명으로 믿고 가장 좋은 전례가 되기를 바라서 대단히 미안한 말씀이지만 이 긴박한 국제정세 국내정세에 있어서 우리의 불상한 삼천만은 갈 바를 모르고 헤매이는 이 국민의 가슴 속에 있는 그것을 표현해 주는 이 마당에 있어서 흐트러진 극도로 흐트러진 이것을 시정해 주십사 해서 외람한 말씀을 합니다.",506
633,779,2,본회의,제14회,제14차,1952,2. 국정전반에 관한 질문,내무부장관 진헌식,12,첫째 유엔군수물자를 취급하는 데 있어서 유엔 헌병과 우리나라 한국 헌병 또는 경찰이 합동해서 그것을 취체하고 있는데 주권국가에 침해가 되지 않느냐 하는 이런 말씀이 있어서 저도 간혹 이 취체하는 것을 볼 때 윤 의원과 같은 똑같은 그런 감상을 가지고 대단히 불쾌한 바를 가진 바도 있었읍니다.,507
634,779,2,본회의,제14회,제14차,1952,2. 국정전반에 관한 질문,외무부차관 조정환,14,"외교관 양성대책은 어떠한가, 해양 주권선을 중심으로 한 대일 외교정책은 어떠한가?",508
635,779,2,본회의,제14회,제14차,1952,2. 국정전반에 관한 질문,외무부차관 조정환,14,그다음에는 해양주권선 문제올시다.,509
636,779,2,본회의,제14회,제14차,1952,2. 국정전반에 관한 질문,외무부차관 조정환,14,이 해양주권선으로 말하면 우리 한국에 있어 한국평화선인데 일본 민족과 우리 두 민족 사이에 한 선을 그어놓고 이 선 사이에는 우리가 서로 권리침범을 하지 말자 그래 가지고 이 선은 반드시 지켜야 한다 국제적으로 지켜야 한다 그러므로 해서 우리는 평화를 유지할 수가 있다 그러므로 이것은 평화선인 것이올시다.,510
637,779,2,본회의,제14회,제14차,1952,2. 국정전반에 관한 질문,외무부차관 조정환,14,"그러므로 이 두 가지 의미에 있어서 해양주권선은 우리의 전력을 다해서, 총력을 다해서 사수하지 않으면 안 될 것입니다.",511
638,780,2,본회의,제14회,제15차,1952,1. 국정전반에 관한 질문,문교부장관 김법린,4,물론 국가의 기본주권을 찾는 데 있어서 첫째 정치 다음에 경제가 대단히 주요합니다.,512
639,780,2,본회의,제14회,제15차,1952,1. 국정전반에 관한 질문,문교부장관 김법린,4,그러나 정치적 독립과 경제적 독립만으로 우리의 주권을 완고하게 보장하기는 어렵다고 하는 것입니다.,513
641,786,2,본회의,제14회,제21차,1952,4. 대한조선공사의 푸로도호 노양작업 급 응급수리자금 정부보증융자 동의의 건,재정경제위원장대리 김봉재,20,"이럼에도 불구하고 정부의 이 해운사업에 대한 시책의 불철저로 인해서 오늘날 신(新) 조선의 격감에 따르는 노후 고장 선박의 증가일로로 인해 가지고 당연히 우리 손으로 해야 할 연안 수송은 물론이고, 해양 주권을 선언한 오늘날에 있어서 이것마저 완전한 무시당하고 있는 이러한 실정에 있다고 할 것 같으면 앞으로는 우리의 문제로 되어 있는 지하자원을 완전히 일본 사람에게 탈취당하고 말 이러한 사정에 있다고 하는 것을 말씀드리는 것입니다.",514
642,793,2,본회의,제14회,제28차,1952,2. 재일교포대표 국회참석에 관한 결의안,엄상섭 의원,14,우리나라 주권이 미치지 않는 지역에 우리나라 법률을 시행시킬 수 없는 것입니다.,515
643,793,2,본회의,제14회,제28차,1952,4. 재일교포대표 국회참석에 관한 결의안,대한민국재일거류민단대표 김재화,19,"그런 점에 있어서 단순하게 저희들이 요청하는 바는 우리 거류민단 제15회 전체대회에서 결정한 그대로 국회에서 뚜렷하니 인정해 주시면 일본에 있어서 60만에 주는 정치적 영향, 또 타면에 있어서도 일본 정부 측에 있어서도 오늘날까지는 일본에 사는 60만 교민을 그야말로 주권 없는 백성으로 우리를 대우하였으나 금후에 본국 정부에서 이와 같이 발언할 기회를 주신다는 것이 만일 대외적으로 공포될 때에 이 백성을 임자 없는 백성 그냥 그대로 취급 못 하리라고 하는 인상을 주어서 여러 가지 면에서 큰 도움이 되리라고 생각합니다.",516
644,794,2,본회의,제14회,제29차,1952,2. 변영태 외무부장관 소환에 관한 긴급동의안,외무위원장 정일형,6,"즉, 첫째 변 외무부장관은 유엔위원단의 보고문에 대하여 ｢현재 당면하고 있는 제 문제의 본질과 의의를 공평히 표현치 못 하는 것이라｣고 전제한 후 ｢외국 관찰자들은 정부의 정치적 반대자들의 불평에만 너무 귀를 기우리고, 개헌안을 통과시킬 것을 요구한 9개의 도의회 전부와 1400을 넘는 지방의회의 결의를 주의치 않은 것 같습니다｣ 이렇게 시종 일관 유엔위원단 보고를 반박하여 ｢가정적 결과와 개념에 관한 것｣이라고 단정하고, 둘째로 또한 변 외무부장관은 ｢국회의원 183명은 대통령선거의 모든 권한을 자기네들 손에 확고히 독자적으로 보지(保持)함을 고집한 것｣이라 하고, 국회가 자기네들 세력을 축소당하는 제안을 반대한 것은 유감된 일이라고 재차 부언하였고, 또한 한국에 와서 민주주의를 고무시킬 임무를 맡고 있는 외국 대표들이 문제의 전모를 망각하고 국회와 더부러 대통령선거라는 주권적 권리를 일반 국민에게 양도하는 것을 비난하였든 것입니다.",517
645,794,2,본회의,제14회,제29차,1952,2. 변영태 외무부장관 소환에 관한 긴급동의안,김양수 의원,8,"그러면 이 제2장의 한국 대의정치의 발전이라고 하는 그 항목 밑에서 그 소절목을 나누어서 대강 행정부 국회 정당 사회단체 우리 일반 상황을 개괄론으로 하고 또 국회의원 보궐선거, 지방자치선거 이런 상황을 쭉 쓴 다음에 헌법 논쟁으로 들어가서, 즉 우리 국회에서 주장하는 책임정치론과 이 박사의 소위 주권재민론 이것이 대립이 되어서, 즉 국회의원이 직선을 반대하는 이유로 말씀할 것 같으면 지금 현하의 한국 정치상에 대해서 현재에 정권을 집권하고 있는 이들이 언제든지 다시 선거를 한다고 하도라도 만년 집권할 수밖에 없다고 하는 이유로 직선을 반대한다고 하는 그런 이유를 들었읍니다.",518
646,801,2,본회의,제14회,제36차,1952,1. 단기 4285년도 제1회 세입세출 추가경정예산안,박정근 의원,8,"나라를 건설하고 나라를 부흥하는 그러한 피차의 애국적 견지에서, 어떻게 하면 좀 우리나라가 잘 되겠는가 하는 그러한 견지에서 적어도 우리가 자주권을 잡었다고 하는 오늘날에 있어서 정부가 이러한 신년도 재정계획에 대해서 사전이라도 국회와 정부가 서로 흉금을 터놓고 이야기할 기회를 만들 필요가 있지 않는가 그런 것을 나는 이야기해 둘 뿐입니다.",519
647,805,2,본회의,제15회,제0차,1952,개의,의장 신익희,2,그러나 우리는 안으로 국민의 생존과 번영을 위하여서나 밖으로 국제적 평화와 정의를 위하여서나 한없는 학살과 노예화인 공산침략을 단연 용허할 수 없고 까닭 없이 유린되는 주권과 강점영토는 단연코 수복되어야 합니다.,520
648,806,2,본회의,제15회,제1차,1952,2. 38도선 이북 탈환지구 행정권 이양 및 귀농지구 확대 인정에 관한 건의안,황성수 의원,18,"아까 이종형 의원께서 말씀하신 대로 우리의 당연한 주권을 찾는다고 하는데 또 일반 농민의 선거민의 의사를 대변해서 그들의 요청, 그들이 원하는 지역에 돌아가고 싶다 하는 이런 의사를 국회가 능히 표시해서 대변하는 데 이의가 없다고 하고, 곽상훈 의원은 다만 이 문제를 작정하는데 일선 작전상 지장이 있을 때에는 곤란하다고 하는 그런 점이 있기 때문에 여러 가지 의견을 표시하는데, 다만 작전상 지장이 없는 한 이런 규정을 넣어서 우리의 의사만 표시한다면 당연히 우리가 발표할 수 있는 의사인 줄 생각합니다.",521
