,회의번호,대수,회의구분,회수,차수,회의연도,안건,발언자,발언순번,sent_raw,sent_id
1504,1473,3,본회의,제24회,제11차,1957,개의,의사과장 이호진,2,"단기 4290년 4월 1일 대통령 이승만 외무부장관 조정환 민의원의장 이기붕 귀하 국제원자력기구협약비준을 위한 국회동의요청의 건 머리의 건 단기 4289년 9월 20일부터 10월 23일까지 뉴욕국제연합본부에서 개최된 국제원자력기구협약제정회의에서 동년 4월 18일 12개국 협약기초위원회가 제의한 협약안을 기초로 하여 최종적 심의를 거쳐 전문 23개 조항과 1부속서로 구성되는 본 협약을 채택하는 데에는 아국 정부를 임병직 대사가 대표하여 참가하고 단기 4289년 10월 26일에 본 협약에 서명하였으며, 동 기구협약은 서명기간인 단기 4290년 1월 23일까지 78개국의 서명이 있었음으로 앞으로 미 영 불 가 쏘의 5개국 중 3개국을 포함하는 18개 서명정부의 비준으로써 발효케 되는바 (1)기구 (2)구성 (3)가입국의 지위 및 (4)기구 가입과 비준으로 나누어 본다면 (1) ‘기구’는 원자력의 평화 번영에 대한 기여를 촉진하는 것을 목적으로 제공된 원조가 군사적 목적을 조장하는 데에는 이용되지 않도록 확보하며 이러한 평화적 이용을 촉진하기 위하여 원자력의 연구 개발, 적용, 정보의 교환, 가입국 상호 간의 특수핵분열성 물질, 기타물질, 역무, 시설의 공급을 확보함에 있어서 중개역할을 하고 한편 원자력의 실제적 운용에 도움이 되는 조작과 역무를 제공하며 보건과 위험방지의 기준을 확립하며 제공된 특수핵분열성 물질, 역무, 설비, 정보 등이 군사적 목적에 사용되지 않도록 보장할 뿐만 아니라 유엔의 목적과 원칙에 의하여 군축계획의 확립을 위하여 활동하고 안전보장이사회에 보고하는 등의 직무를 수행하기로 규정되었으며 (2) ‘구성’에는 총회와 이사회를 거시(擧示)할 수 있으며 총회는 전 가입국의 대표로서 구성되어 매년 1회 정기총회를 개최하며 가입국은 대등한 1표의 투표권을 가지며 의결은 다수결에 의하되 (ㄱ)재정문제 (ㄴ)협약개정 (ㄷ)가입국의 권리의 정지에 관한 사항은 3분지 2의 다수결에 의하며, 이사회는 5대 원자력지도국과 2원료국 1기술제공국 5지역대표국(이상의 이사국의 임기는 1년이며 퇴임이사회가 지명하되 제1회 총회 이전의 이사국 지명은 18개국 준비위원회가 행함) 및 10개 수익국(총회에서 선출함, 임기 2년이되 매년 반수를 개선함)의 23개 이사국으로 구성되어 기구 운영의 권한과 책임을 가지며 의결은 다수결에 의하되 기구의 예산액의 결정은 3분지 2 다수결에 의하며 (3) ‘가입국의 지위’ 기구가 그 활동을 수행함에 있어서는 가입국이 주권적 권리를 정당하게 존중하여야 하며 또 기구는 전 가입국의 주권 평등의 원칙을 기초로 하며 동시에 가입국은 가입국이 됨으로써 받을 수 있는 모든 권리와 이익이 전 가입국에 미칠 수 있도록 보장하기 위하여, 협약에 의하여 부과된 의무를 성실히 수행하여야 한다는 취지하에 협약에 규정된 목적을 수행하기 위하여 가입국에 대하여 실시하는 감시 또는 이에 대한 시정조치와 제재에 복종토록 규정되었으며 (4) ‘기구 가입과 비준’ 서명국가는 본 협약 제31조에 의하여 각 국가의 헌법절차에 의하여 비준서를 기탁하게 되는바 아국의 헌법상으로는 본 기구는 전기한 취지에 비추어 일반 국제조직이라는 형식적 이유뿐만 아니라 실질적 이유로서는 본 기구에 가입하므로 인하여 발생되는 재정적 부담으로서 기구행정비와 기구로부터 물질 역무 장비 및 시설의 제공을 받을 경우에 이에 대한 부담금이 있으며, 본 협약에 의하여 아국 정부가 필요한 경우에 전기한 역무 시설 등을 받아들임에 있어서 이에 대한 제반 처리를 원만하게 하기 위하여 필요한 입법조치가 수반될 것으로 사료되므로 비준서를 기탁하여 본 기구에 가입코저 헌법 제42조에 의거하여 비준에 관한 국회의 동의를 요청하오니 민의원의 동의를 의결하여 주시기를 바라나이다.",1325
1505,1477,3,본회의,제24회,제15차,1957,5. 국회법 중 개정법률안 제1독회,황남팔 의원,15,오늘의 우리 사회의 이 혼란이 이와 같이 심각하게 퍼뜨러지고 있다는 그 이유는 여러 가지 방면으로 지적할 수 있겠지만 가장 중대한 원인은 주권자인 국민으로부터 국정에 대한 수임을 받은 우리 입법기관인 국회가 그 운영에 있어서의 올바른 길을 가지 못함으로 말미암아서 이러한 중대한 원인을 비져냈다고 하는 것을 아니 지적할 수가 없는 것입니다.,1326
1506,1477,3,본회의,제24회,제15차,1957,5. 국회법 중 개정법률안 제1독회,운영위원장 조순,19,더군다나 중대안건의 심의에 있어서는 이것이 자기의 선출 구의 구민들의 그 의사가 어디에 있는가를 충분히 이것을 알어 가지고 이 주권자인 백성의 의사에 좇아서 이것을 행동으로써 나타내는 것이 국회의원의 의무인 것이고 이 행동에 있어서는 만인이 다 알 수 있도록 명명백백한 행동을 하는 것이 원칙일 것이고 또 외국의 대부분의 예가 다 이렇게 되어 있는 데에서 우리나라의 국회에서도 해야 되겠다는 데 불과합니다.,1327
1507,1478,3,본회의,제24회,제16차,1957,2. 지방자치단체 폐치분합․동장선거와 국민반 조직에 관한 보고,이철승 의원,4,"지금 조례를 안 만들고 규칙을 안 만들어 가지고 서리를 두어 가지고 동 조장행정을 마비를 시키고 있고, 경찰이 국민반 조직의 지도원 노릇을 하고 있고 또 등록된 야당의 단체 월례회에 형사들이 아랫목을 차지하고 있고 이런 것을 해 가지고 나가 가지고 무엇을 무슨 인권신장이네 뭐 주권옹호 국민주권재민이네 하는 소리를 가지고 언족이식비로 이야기하는 참 눈을 감고 아웅 하는 소리가 아닌가 이렇게 생각할 때에 이 문제는 내무분과위원회에서 마침내 논란 중에 있는 문제라고 생각하기 때문에 참 주의를 환기시키기 위하여 보고를 하고 여러분이 이러한 사태를 참작을 하셔서 내무위원회에서 관심을 가져 주십사 하고 제 지방의 문제를 이렇게 장시간 말씀드린 것을 퍽 외람되게 생각합니다마는 용서해 주시기 바랍니다.",1328
1508,1478,3,본회의,제24회,제16차,1957,5. 영국의 대북한수출금지령 해제에 관한 대정부 질의,윤치영 의원,26,여러분 잘 아시다싶이 구라파에서 백의이라고 하는 나라나 정말이라는 나라가 우리보다 낫거나 실력이 있어서 국제적으로 독립국가의 주권을 유지하고 대외에 대한 외교적 관계를 민활히 맺어 가는 것이 아닙니다.,1329
1509,1478,3,본회의,제24회,제16차,1957,5. 영국의 대북한수출금지령 해제에 관한 대정부 질의,윤치영 의원,26,대외적으로 자기 나라의 이익을 위하고 주권을 옹호할 때에는 국제법 질서에 의지할 뿐만 아니라 역사적 전통으로 내려오는 한 그 관계된 사실을 어디까지든지 민첩하고 가장 지혜롭게 해 가기 때문에 구라파의 열여섯 열일곱 나라의 약육강식하는 그 우승열패를 다투는 그 가운데에 있어서 자기의 생존을 유지해 오고 오늘날 민족적 번영 발전을 유지해 오는 것인데 대한민국은 삼팔선이 있어서 반 토막의 갈라진 이 나라라고 하지마는 우리가 내부적으로 결속하고 단결한다고 하며는 세계 어떤 나라보담도 강하게 나갈 수 있다는 자신이 있는 이 나라입니다.,1330
1510,1478,3,본회의,제24회,제16차,1957,5. 영국의 대북한수출금지령 해제에 관한 대정부 질의,김정호 의원,41,그러면 일본은 단시일간에 1952년부터 1956년 12월 18일까지 약 4년간에 걸쳐서 국제외교를 어떻게 맺었던 간에 대동아전쟁 때에 적국으로 되어 있던 42개국까지도 가담해 가지고 80개국 중에서 70개국이라는 다대수의 국가의 승인을 다 받어 가지고 당당하니 국권을 행사하는데 오늘날 우리는 왜 그런 상태에 놓여 있지 못하는가?,1331
1511,1478,3,본회의,제24회,제16차,1957,5. 영국의 대북한수출금지령 해제에 관한 대정부 질의,외무부장관 조정환,50,북한 정권을 승인하는 결과로 나올 것 같으면 우리 대한민국에 대한 주권의 무시이고 우리 생존에 대한 무시이기 까닭에 우리의 경고 우리의 요청 우리의 방침에도 불구하고 우리의 존립 우리 주권에 대한 영향이 있을 때에는 우리는 중대한 각오를 아니 할 수 없다는 그런 의미입니다.,1332
1512,1482,3,본회의,제24회,제20차,1957,3. 진보당 서울시당 및 경기도당 결당대회 방해에 관한 보고,김달호 의원,14,"수도 서울 내에서 하는 것을 특징을 우리가 알어야 되고 또 한 가지는 국회에서 현재 국회법을 갖다가 개정한다, 국회법 개정이 반민주주의적 방향으로 흘러간다는 야당 측의 비난을 받으면서 이것이 진행되고 있는 이때이고 또 국회의원선거법을 갖다가…… 빨리 주권을 갖다가 강도질하는 것을 막어 보기 위해서 만들어 보자고 하는 이 법을 곧 심의해야 한다, 이와 같은 일련의 사태로 해서 내년의 선거문제에 관심이 높을 적에 그 시기에 그대로 이것이 자행된다고 하는 것은 역시 장차 닥쳐올 여러 가지 선거문제의 전초적인 어떠한 사태를 예견하는 것이 아니냐, 이와 같은 것을 우리가 추측할 수 있는 것입니다.",1333
1513,1482,3,본회의,제24회,제20차,1957,3. 진보당 서울시당 및 경기도당 결당대회 방해에 관한 보고,김달호 의원,14,"기타 여러 가지의 특징적 측면을 우리가 볼 수 있는데 그와 같은 것은 시간관계로 해서 생략하기로 하고 요컨대 우리나라가 후진국이라 해서 항상 잘못된 것을 자인하고 있었는데 특히 동남아세아의 여러 후진국에 비해서, 마찬가지 후진국이니까 테로쯤은 참어야 되겠다는 논리도 성립이 될는지 모르겠읍니다마는 하여튼 우리나라가 이북에 우리의 적 공산당이 있고 또 국제적으로 우리나라가 점점 고립해 가고 있는 이 마당에 경제적으로 완전히 파탄이 되어 사회적으로 전부 질서가 유린되어 가고 있는 이 마당에 이것이 명년의 총선거를 앞두고 수도 서울에서까지 이와 같은 불법적 경찰의 직무유기의 반면에 생기는 이와 같은 불법적 행사가 자행 폭발된다고 하는 사태는 이것이 어떤 측면으로 보면 어떤 정치 크럽의 단말마의 고민상이 아닌가도 생각하지마는 그것은 그네들에게 맡겨 둘 문제이거니와 우리 국회의원은 이와 같은 민주주의의 파괴행동, 좀 심하게 말하며는 가령 외국 사람이 직접 주권을 뺏어 가지고 주권행사를 갖다가 침략하고 방해할 적에 그것이 무슨 제국주의니 우리를 식민지로 만드느냐 하는 비판이 성립되는 것과 마찬가지로 국내적으로 우리가 말이에요 우리 국민 자신이 우리의 선거권을 갖다가 폭력적으로 박탈하는 이와 같은 방식하고 같은 계열에 선 이 집해방해사건 내지 일련의 이 테로사건은 우리 한국의 장래 민주주의 발전을 위해서 어떤 신문이 보도한 바와 마찬가지로 실로 통곡할 바가 아닌가 이렇게 생각이 되는 것이며, 이와 같은 행동이 장차에도 종식되지 않고 그냥 계속되어 나가다가는 아세아의 남단에 붙어 있는 이를테면 그 형태적으로 보아서 이를테면 맹장적 입장에 있다고 볼 수 있을까.",1334
1514,1484,3,본회의,제24회,제22차,1957,3. 국민반 조직 등에 관한 질문,박영종 의원,14,또 헌법의 제1조 ‘대한민국은 민주공화국이다.’ 하는 그 정신 또 제2조 ‘대한민국의 주권은 국민으로부터 나온다.’ 하는 그 정신에 대해서도 위배된다는 것으로 본 의원은 해석하는데 귀관의 의견은 무엇인가?,1335
1515,1485,3,본회의,제24회,제23차,1957,1. 국민반 조직 등에 관한 질문,내무부장관 장경근,10,민주국가에 있어서는 주권자가 국민입니다.,1336
1516,1485,3,본회의,제24회,제23차,1957,1. 국민반 조직 등에 관한 질문,이철승 의원,34,"우리는 민주정치를 지금 언필칭 말하기를 주권재민이다, 민주정치는 민의를…… 민의를 말씀이에요 민의를 국정에 반영시키는 로타리로써 정당이 그 역할을 하는 것이다 이렇게 민주정치 초보에 해명이 되었습니다.",1337
1517,1485,3,본회의,제24회,제23차,1957,1. 국민반 조직 등에 관한 질문,이철승 의원,34,"제안설명 시에 주권재민 민권신장을 위해서 우리는 국민투표제를 채택해야 하겠다, 간접민주제보다 직접민주제를 해 가지고 국민투표제를 채택해야 한다, 우리는 선진국가에 따라가야 한다고 아주 여기서 참 열렬하게 주장하시던 장 장관이 어쩌면 그렇게도 지금 얘기하고는 모순이 생기는지, 상말로 쓰면 뱉고 달면 삼키고 그런 식으로 지금 얘기를 하시는 것인지 말씀이요.",1338
1518,1487,3,본회의,제24회,제25차,1957,2. 국회의원선거법안 심의 촉진에 관한 건,소선규 의원,31,우리는 어디까지나 자유당이건 야당이건 간에 막론하고 이 선거법 개정에 있어서 우리가 첫째 머리에 유의를 해야 할 점은 국민주권행사를 어떻게 하면 좀 정확하게 행사가 되고 어떻게 하며는 공명정대하게 되느냐고 하는 이 점만 생각하신다고 할 것 같으면 나는 선거법 심의가 그렇게 어렵지 않은 문제라고 생각합니다.,1339
1519,1487,3,본회의,제24회,제25차,1957,2. 국회의원선거법안 심의 촉진에 관한 건,소선규 의원,31,그렇기 까닭에 이 수임을 맡으신 상임위원회에서는 여당에 속한 의원이건 야당에 속한 의원이건 자기의 당의 관념 당의 인연을 전부 끊고 국민주권을 행사시키는 데에 어떻게 하면 조금이라도 더 명랑하게 조금이라도 더 공정하게 될 것이라고 하는 점에 철두(徹頭)해 주시기를 바라면서 모처럼 김성호 의원께서 좌우간 30일 동안 꼭 필요하다고 하기 까닭에 저는 2주일 설을 고집을 버리고 30일 설에 제가 찬동하고 합류하는 것임에 30일 이내에는 틀림없이 이 국회에 상정되리라고 하는 것을 믿고 저는 제 설은 포기합니다.,1340
1520,1487,3,본회의,제24회,제25차,1957,5. 국민반 조직 등에 관한 질문,김선태 의원,56,이러한 지금 우리 국민 주권을 행사하는 지방선거를 위시해 가지고 심지어는 꼬래비 동장선거에 이르도록까지 지금 이 시간까지도 어 엊그제까지도 등록을 방해하고 또 선거를 방해하고 그래 가지고 음으로 양으로 노골적으로 음침하게도 방해를 하고 있는 이 마당에 있어 가지고 애석하게 이 나라의 치안의 총책임자인 장 내무부장관이 그 실정을 모르고 ‘사과해 주오.,1341
1521,1488,3,본회의,제24회,제26차,1957,2. 국무위원 출석요청에 관한 건(외무․법무),김달호 의원,6,이것은 우리 주권국가로서 도저히 묵과할 수 없는 것이며 우리의 민족양심에 비추어서 도저히 용서할 수 없는 것입니다.,1342
1522,1488,3,본회의,제24회,제26차,1957,2. 국무위원 출석요청에 관한 건(외무․법무),김달호 의원,6,"한 가지는 그와 같은 법이 없기 때문에 이와 같은 불법행동 내지 그 이상의 행동을 해도 묵과 좌시해야 된다는 견해가 생길 것이고 그렇지 않다, 우리가 주권국가인 이상은 외국군대가 이 나라에서 불법행동을 할 적에 우리나라 법에 의해서 처단해야 한다, 두 가지의 견해가 성립이 되는 것입니다.",1343
1523,1488,3,본회의,제24회,제26차,1957,2. 국무위원 출석요청에 관한 건(외무․법무),김달호 의원,6,그러나 그와 같은 문제는 자유세계 전체를 보장한다고 하는 그와 같은 생각 밑에 이루어지는 것이고 그네들이 엄연한 우리 주권국가에 와서 특히 군대의 규율을 감시하는 헌병이 집단적으로 이와 같은 만행을 한다고 하는 것을 용인하라는 논리는 생기지 않는 것입니다.,1344
1524,1488,3,본회의,제24회,제26차,1957,5. 파주에서의 미헌병 불법사건에 관한 질문,김달호 의원,15,우리가 지금 생각할 것은 우리나라는 주권국가라고 하는 의식을 여러분 두뇌에 확실히 좀 주입해 달라 그 말씀이에요.,1345
1525,1488,3,본회의,제24회,제26차,1957,5. 파주에서의 미헌병 불법사건에 관한 질문,김달호 의원,15,"행정협정이 안 생겨도 우리 주권국가로서 의당히 법의 집행을 해야 한다 하는 견해가 생긴 것이고 또 한 가지는 행정협정이 생기지 않은 이상에는 외국군의 행동에 대해서 치외법권적 그러한 특권을 주어야 된다 이와 같은 의견이 생기는 것인데, 만약 현 법무부장관은 어떠한 생각을 하는지 모르겠지만 행정협정이 안 생기는 이상에는 5년 10년 20년이고 간에 외국군대의 국내에 있어서의 불법행동을 처단하지 못한다는 사고를 옳다고 본다면 그네들은 무법천지라고 해도 얼마든지 할 수 있느냐 하는 말이 아니냐 그 말씀입니다.",1346
1526,1488,3,본회의,제24회,제26차,1957,5. 파주에서의 미헌병 불법사건에 관한 질문,김달호 의원,15,"행정협정이 생기기 전에 외국군이 우리나라에서 자기네 감독을 배반해 가면서 우리 국민에게 불법적 행동을 했을 적에 우리 주권이 우리 형사의 그 권한이 미치지 못한, 그네들한테 미치지 못한 원인을 그 이유를 좀 우리들한테 얘기해 달라 그 말이에요.",1347
1527,1488,3,본회의,제24회,제26차,1957,5. 파주에서의 미헌병 불법사건에 관한 질문,김달호 의원,15,"나 같은 사람의 생각에는 세밀한 행정협정이 생기기 전에 만약 우리가 우리의 주권이 발동할 적에 세세한 기술적 문제에 마찰이 생길 염려가 있다 하는 것은 우리가 우려해도 좋겠지만 전적으로도 우리의 주권행사를 외국군대에 대해서 포기하는 이유는 어디에 있느냐, 그것은 이북의 빨갱이들이 쏘련군대의 만행을 묵과하는 것과 마찬가지 결과가 아니냐 그 말이에요.",1348
1528,1488,3,본회의,제24회,제26차,1957,5. 파주에서의 미헌병 불법사건에 관한 질문,정준 의원,30,"그런데 특히 우리 한국에 와 있는 외군들이 우리가 그동안 알게 모르게 이 나라의 국민을 무시하고 이 나라의 국권을 무시하고 행동한 일이 얼마나 많은가, 우리는 너무도 신경이 무디어서 남의 나라의 속박 밑에서 살어왔던 그런 까닭에 남한테 쑥스러움을 당하고 억울한 일을 당하고 구속을 당하는 일을 하는 데 있어서 너무도 신경이 예민하지 못해서 알게 모르게 그와 같은 일을 당하고 넘어가는 것이 얼마나 많은지 모르겠읍니다.",1349
1529,1489,3,본회의,제24회,제27차,1957,2. 국민반 조직 등에 관한 결의안,염우양 의원,29,그러므로서 우리나라의 지금 현재의 위치와 또한 우리나라의 여러 가지 방면으로 보아서 우리 국민들은 이것을 통일해 가지고 정신을 합해 가지고 이런 좋지 못한 사상이 좋지 못하고 우리나라 주권까지 침해할려고 하는 사람에게 이것을 색출해 가지고 우리나라의 주권을 유지해 나가겠다는 것이 무엇이 잘못인지 그 이유를 알 수 없다는 것을 첫째 말씀드리는 바이올시다.,1350
1530,1491,3,본회의,제24회,제29차,1957,1. 서울특별시 동장 선거에 관한 보고,김선태 의원,2,그것은 우리가 자유민으로서는 자유 인민이 그러한 자기의 주권을 박탈당할 수 없다 해 가지고 우리 민주주의에 있어 가지고는 공정선거를 한다 자기 주권을 자기 자의대로 자유로 행사할 수 있도록 하는 것이 말하자면 공산당의 독재와 유별하는 구별을 하는 우리 민주주의인 것입니다.,1351
1531,1492,3,본회의,제24회,제30차,1957,4. 하계 일광절약을 위한 「썸머타임」의 실행 폐지에 관한 질문,법무부장관 이호,32,이 점에 관해서는 물론 이 민주정치하에서 주권자인 국민의 대표 여러분이 결의했는 것을 정부로서는 될 수 있으면 이것을 받어들여야 옳을 줄 압니다.,1352
1532,1499,3,본회의,제25회,제1차,1957,개의,의사국장 서상준,2,‘가입국의 지위’ 기구가 그 활동을 수행함에 있어서는 가입국의 주권적 권리를 정당하게 존중하여야 하며 또 기구는 전 가입국의 주권율 등의 원칙을 기초로 하여 동시에 가입국은 가입국이 됨으로서 받을 수 있는 모든 권리와 이익이 전 가입국에 미칠 수 있도록 보장하기 위하여 협약에 의하여 부과된 의무를 성실히 수행하여야 한다는 취지하에 협약에 규정된 목적을 수행하기 위하여 가입국에 대하여 실시하는 감시 또는 이에 대한 시정조치와 제재에 복종토록 규정되었으며  4.,1353
1534,1505,3,본회의,제25회,제7차,1957,"2. 의원징계에 관한 건(장택상)",류진산 의원,35,민주주의국가에 있어 가지고 주권은 국민에게 있다고 하면서 어찌 국민의 대변자인 이 의사당 안에서 대통령에 대한 비판을 못 한다 말이에요?,1354
1535,1505,3,본회의,제25회,제7차,1957,"2. 의원징계에 관한 건(장택상)",류진산 의원,35,만일 우리가 이 의사당 안에서 대통령의 그 치적을 비판하고 규탄할 자유가 없다면 우리 삼천만 국민은 어디에 가서 자기 주권을 행사하고 자기 수임자인 대통령의 처사에 대해 가지고서 비판하고 규탄하고 할 수가 있겠읍니까?,1355
1536,1505,3,본회의,제25회,제7차,1957,"2. 의원징계에 관한 건(장택상)",류진산 의원,35,우리 국민이 투표를 해 가지고 대통령을 뽑았지만 결코 우리 국민의 주권이 대통령에게 이동한 것이 아닙니다.,1356
1537,1505,3,본회의,제25회,제7차,1957,"2. 의원징계에 관한 건(장택상)",류진산 의원,35,어디까지나 우리 국민은 주권자이에요.,1357
1538,1505,3,본회의,제25회,제7차,1957,"2. 의원징계에 관한 건(장택상)",류진산 의원,35,주권자의 대변인이 이 자리에 앉어 있는 것이에요.,1358
1539,1505,3,본회의,제25회,제7차,1957,3. 장충단집회 방해사건에 관한 질문,법무부장관 이호,54,그래서 적당한 범위 내에서 우리들이 하고 있는 일이 일반주권자인 국민에게 어느 정도 알어야 된다고는 생각하고 있읍니다마는 이것이 너무 지나치고 도를 지나쳐서 발표됨으로 해서 수사에 지장을 초래하고 또 거기에 관계한 사람의 명예를 훼손하는 일이 있다면 이것은 대단히 유감된 일로 생각합니다.,1359
1543,1511,3,본회의,제25회,제13차,1957,2. 국제원자력기구협약에 관한 동의안,외무부장관 조정환,14,이 원자기구를 설치하는 데 있어서 각 회원국의 주권은 평등을 절대적으로 존중하는 의미에서 사찰도 있을 것이고 또는 다소 교정도 받어야 할 것이고 제약도 받어야 할 것입니다.,1360
1544,1512,3,본회의,제25회,제14차,1957,1. 원자력수훈군인 행방불명에 관한 건,소선규 의원,10,이러한 사태를 우리 국회가 두말할 것도 없이 주권자인…… 수임을 받어 가지고 대변한다고 자처하고 있는 우리 국회의원이 이 사건의 진상을 묵과할 수는 없을 것입니다.,1361
1545,1512,3,본회의,제25회,제14차,1957,1. 원자력수훈군인 행방불명에 관한 건,소선규 의원,10,이러한 중대한 사건의 내용을 모르고 우리의 주권자 앞에 나가서 보고할 수가 있을 것입니까?,1362
1546,1512,3,본회의,제25회,제14차,1957,2. 교통부 열차승무원 파면조치에 관한 건,박영종 의원,12,국민이 가지고 있는 주권에 입각해서 공직자에 대해서 요구하는 것이에요.,1363
1547,1512,3,본회의,제25회,제14차,1957,3. 국민식량문제와 농촌대책 및 중소기업육성 등에 관한 건의안,김달호 의원,26,내 주권자 인민에 인민을 위한 인민의 정치에 있어서 인민의 대변자 여러분이 한 결의라 말이에요.,1364
