,회의번호,대수,회의구분,회수,차수,회의연도,안건,발언자,발언순번,sent_raw,sent_id
1040,1096,3,본회의,제19회,제80차,1954,2. 한국통일 총선거에 대한 질문,박재홍 의원,16,그러면 우리 변영태 씨는 적어도 세계만방에 비추어서 그야말로 뚜렷하게 대한민국의 외무장관이오 또 뿐만 아니라 특사로서 제네바에 가 가지고 뜻하지 않는 제네바회담이라고 할지언정 정정당당하게 국제적으로 우리의 보장을 받아야 될 것임에도 불구하고 이제야말로 국제적으로 보장되어 있는 새로히 오히려 우리나라의 주권을 부인하는 듯한 이러한 14개 항목의 토의 발표라는 것은 도대체 어데서 나온 것이냐 이 말이에요.,884
1041,1096,3,본회의,제19회,제80차,1954,2. 한국통일 총선거에 대한 질문,박재홍 의원,16,"여러분, 어떻게 해서 남북총선거를 할 수가 있다 하는 이와 같은 발표가 있을 수 있겠읍니까?그러면 북한에만 국한해 가지고 보결선거를 해 가지고 대한민국 입법부에 채운다는 것은 알 수 있읍니다마는 ‘남북총선거를 할 수 있다’, 이야말로 우리나라의 법에는 대한민국의 법에는 헌법에 위반하지나 주권을 침해하지나 공안을 해하거나 하면 보안법에 해당하는 것입니다.",885
1042,1096,3,본회의,제19회,제80차,1954,2. 한국통일 총선거에 대한 질문,조병옥 의원,18,"그런고로 차라리 우리 국회로서는 우리 국회의원들이 솔직히 의견을 토의해 가지고 이 문제를 어떻게 수습해야 되겠는가, 다시 말하면 우리 국회의 만장일치의 의사가 대한민국 주권의 확대로서 유엔 감시하에 북한에 선거하는 것이 오직 대한민국의 국시라고 천명한 이상 우리는 그 입장을 견지해 가지고 정부를 견제하고 그래 가지고 국회에서 새로운 정책에 의지해 가지고 외교활동을 해 나가라는 것을 명령한 도리밖에 없다고 생각합니다.",886
1043,1096,3,본회의,제19회,제80차,1954,2. 한국통일 총선거에 대한 질문,조병옥 의원,18,그러나 당시에 우리 정부는 유엔총회에 대해 가지고 이는 대한민국의 주권을 침해하는 것이고 대한민국의 국시를 무시하는 결정이라고 항의 한 마디도 안 하였든 것입니다.,887
1044,1096,3,본회의,제19회,제80차,1954,2. 한국통일 총선거에 대한 질문,조병옥 의원,18,역사의 실말이가 이렇게 기묘하게 벌어져 가지고 38 이남의 적은 판도 내에서 대한민국 주권하에 살게 된 우리로서는 은인자중 지구전을 해 가지고 지모를 다 해 가지고 땀을 흘리고 눈물을 흘려 가지고…… 그래 가지고서야 남북이 통일될 것이라는 것을 우리가 알아야 될 것입니다.,888
1045,1096,3,본회의,제19회,제80차,1954,2. 한국통일 총선거에 대한 질문,전상요 의원,28,그 승인했다는 것은 우리 대한민국 정권을 승인한 것이 아니고 우리 대한민국 헌법을 검토하고 우리 대한민국 주권을 승인했다는 것입니다.,889
1046,1096,3,본회의,제19회,제80차,1954,2. 한국통일 총선거에 대한 질문,전상요 의원,28,"그 승인한 헌법이라는 것은 첫째 대한민국은 민주공화국이라고 칭했고, 그다음으로 대한민국 판도는 한반도와 및 부근 도서를 다 찾이하여야 된다고 했고, 세째로는 대한민국이 주권이라는 것은 어떤 나라도 침략을 못했다고 했읍니다.",890
1048,1096,3,본회의,제19회,제80차,1954,2. 한국통일 총선거에 대한 질문,전상요 의원,28,그런데 금일에 와서 또 다른 우리 대한민국 주권을 무시하는 이 남북총선거라는 문제는 도저히 있을 수 없는 문제입니다.,891
1049,1096,3,본회의,제19회,제80차,1954,3. 국무위원 출석요청에 관한 건,이인 의원,34,그러면 이 나라의 금융하고 국민질서의 주권하고는 어떻게 됩니까?,892
1050,1096,3,본회의,제19회,제80차,1954,3. 국무위원 출석요청에 관한 건,이인 의원,34,그나마 자기 딸라를 이 나라에 갖다가 판다니 이 나라의 주권을 완전히 유린하고 말었어요.,893
1051,1097,3,본회의,제19회,제81차,1954,1. 한미회담 경과보고와 질문,이인 의원,4,주권은 국민에게 있읍니다.,894
1052,1098,3,본회의,제19회,제82차,1954,1. 헌법 개정안,이재학 의원,4,함에도 불구하고 오늘날에 와서 다시 남북 총선거니 해 가지고 우리나라의 주권을 무시하려는 이러한 논의가 된다는 그 자체가 우리로 하여금 이러한 안을 내지 아니치 못하게 한 것입니다.,895
1053,1098,3,본회의,제19회,제82차,1954,1. 헌법 개정안,이재학 의원,4,그러기 때문에 우리가 여기서 채택하자는 것은 다만 주권의 이약(利約)이나 영토의 변경을 가저오는 국가안위에 관한 중대 사항에 관해서만 하자는 것입니다.,896
1054,1098,3,본회의,제19회,제82차,1954,3. 헌법 개정안,조영규 의원,8,"그런데 국가안위에 관한 중대 사항, 대한민국의 주권의 제압과 영토의 변경을 국회의 가결을 얻어서 이렇게 되어 있으니 이것은 도대체 어떻게 되는 셈이냐 이 말씀입니다.",897
1055,1098,3,본회의,제19회,제82차,1954,3. 헌법 개정안,이재학 의원,14,또 국회에서도 이런 조항을 맨들어 놓으면 적어도 전 국민이 찬성하는 문제 이런 데 관한 소위 주권의 제약이나 영토 변경 같은 그런 관계까지는 전 국민이 찬성하지 않는 그러한 것이 아니면 국회에서 가결할 수도 없게 되는 것입니다.,898
1056,1098,3,본회의,제19회,제82차,1954,3. 헌법 개정안,황성수 의원,17,왜 그러냐 하면 만약에 이제 조영규 의원 말씀과 마찬가지로 중요한 국가의 영토의 변경이나 주권의 제약을 하는 중대 사항에 대해서 203명 국회의원 가운데 52명이 회흐리 바람을 처 가지고 그냥 결정했다면 그냥 거기에만 맡기지 아니하고 국민투표에 다시 한 번 물어야 한다고 하는 좋은 근거가 되는 것입니다.,899
1057,1098,3,본회의,제19회,제82차,1954,3. 헌법 개정안,황성수 의원,17,"군주정치에 있어서는 군주가 주권을 가젔지만 민주주의 정치에 있어서는 국민이 주권을 가진 것이다, 어떻게 하면 국가를 좀 더 공고한 기초 우에 두어 볼까 생각할 때에 이것은 소수의 행정수뇌나 어떠한 소수의 정당인이나 소수의 국회의원보다는 그 최후적인 근거는 국민에게 두어야 국가의 기초가 공고히 된다고 말씀하시고 그렇기 때문에 보통 때에는 행정부가 책임을 지고 보통 때에는 국민이 투표한 국회의원이 모든 일을 하되 가장 중요한 문제에 있어서는 국민에게 다시 한 번 묻는 혹은 물을 수 있는 적어도 국민에게 기반을 이 나라가 가진 것이라는 것을 표시하는 그 점을 우리 헌법에 두어야 한다.",900
1058,1099,3,본회의,제19회,제83차,1954,2. 헌법개정안,이우출 의원,10,국민투표제를 말씀드린다고 하면 물론 ‘주권의 제약 영토의 변경을 가져올 국가안위에 관한 사항’이라고 이렇게 되어 있읍니다.,901
1059,1099,3,본회의,제19회,제83차,1954,2. 헌법개정안,이우출 의원,10,그러면 이러한 의사를 표시할 때에 ‘우리는 국회로서 국민의 대변자로서 국민을 대표한 의결기관으로서 우리는 국시를 재천명하여 이북의 100석만 공석을 선거해 가지고 보충할 뿐이지 그 이외에는 우리의 주권을 변동할 수 없고 제약을 받을 수 없다’ 이렇게 해서 우리는 국회의 의결로써 이것을 우리가 결정해서 해외 만방에 재천명했읍니다.,902
1060,1099,3,본회의,제19회,제83차,1954,2. 헌법개정안,이우출 의원,10,즉 주권의 제약을 도리혀 초래하리라고 봅니다.,903
1061,1099,3,본회의,제19회,제83차,1954,2. 헌법개정안,이우출 의원,10,그러니까 이러한 두 가지의 예를 들어서 제가 말씀한 것은 제가 알기로는 주권의 제약이나 영토의 변경을 가저올 국가안위에 관한 중대한 사항이라고 생각하는데 이것을 구체적으로 우리 국민이 알고 우리들이 충분히 이해할 수 있도록 어느 때에 어떠한 경우에 이 국민투표제를 실시한다든지 필요하다든지 하는 것을 말씀해 주시기 바라는 바이올시다.,904
1062,1099,3,본회의,제19회,제83차,1954,2. 헌법개정안,장경근 의원,20,"둘째로 그러면 아까 예를 들어서 말씀하시기를 한국은 주권국가이다, 한국을 참례시키지 않고 유엔이 한국에 관한 모든 결의를 해도 좋으냐, 그것과 마찬가지로 참의원 없이 민의원에서 모든 것을 결정해도 좋으냐, 이것은 대단히 정확치 못한 것이라고 생각합니다.",905
1063,1099,3,본회의,제19회,제83차,1954,2. 헌법개정안,장경근 의원,20,물론 주권국가이면 한국이 유엔에 가입하지 않었다고 하드라도 적어도 한국문제를 결정하는 데 있어서는 우리 한국을 초청해서 의견을 청취해 가지고 그것을 존중해서 결의해야 되리라고 생각합니다.,906
1064,1099,3,본회의,제19회,제83차,1954,2. 헌법개정안,장경근 의원,20,"그다음에 국민투표문제에 들어가는데 영토 변경을 가저올 주권의 제약이라는 축소적인 문구를 썼지만 영토 변경이라는 것은 축소도 될 수 있는 것이고 확대도 들어 있다, 확대라는 이런 좋은 경우에는 이것을 상정 안 해도 좋지만 영토 축소라고 제약 이런 것은 곤란하기 때문에 이것을 그냥 변경이라고 한 것을 제안자로써 설명해 드립니다.",907
1065,1099,3,본회의,제19회,제83차,1954,2. 헌법개정안,장경근 의원,20,"여섯째로 주권의 제약이라는 것은 을사조약 같은 것, 이 대통령을 믿고 있는 자유당에서 이 대통령이 을사조약 같은 것을 체결하리라고 상상하고 그것을 의심할 필요가 없지 않으냐, 이 대통령이 을사조약 같은 것을 맺일 리가 있느냐, 반드시 이 대통령이 잘못한다는 그 잘못에 대해서 이런 국민투표제를 만드는 것이 아니고 또 국회가 반드시 나라를 팔어먹으리라고 염려해서 이것을 만드는 것은 아닙니다.",908
1066,1099,3,본회의,제19회,제83차,1954,2. 헌법개정안,장경근 의원,20,"그러나 잘한다고 하드라도 행정권만을 맡어 가지고 입법 사법권은 다른 데에서 해야 되겠기예 국가안위의 중대한 사항은 주권을 가진 국민이 결정권을 가져야 된다, 이런 것이 다만 신용한다고 할 것 같으면 거기에 대한 감독규정이라든지 이런 권한을 제한하는 규정이 없다 하면 이것이야말로 가장 비민주주의적인…… 국민이라는 것을 전연 멸시하고 직권을 한한 사람에게 맡끼는 그런 결론에 도달하리라고 생각합니다.",909
1067,1099,3,본회의,제19회,제83차,1954,2. 헌법개정안,장경근 의원,20,"저는 행정부나 국회에서 이런 것을 결정한다고 하면 그것이 옳게 되지 않겠느냐, 또 행정부․입법부에서 이것을 하는데 어떻게 국민이 막아낼 수 있겠느냐 이런 것을 말씀한다면 이것은 우리 헌법 제2조에 ‘우리 주권은 국민에게 존재한다’는 주권재민의 정신에 위배되는 말씀이라고 생각합니다.",910
1068,1099,3,본회의,제19회,제83차,1954,2. 헌법개정안,장경근 의원,20,그 대표자는 백성의 의사를 반영시켜야 할 것이고 또 반영 않 시키는 경우에는 이 본래의 주권자인 국민이 감독을 하여야 됩니다.,911
1069,1099,3,본회의,제19회,제83차,1954,2. 헌법개정안,장경근 의원,20,일곱째로 주권제약은 신탁통치를 막아내는 것은 헌법이나 국민투표로 막어내는 것은 삼천만의 3․1운동정신 이러한 운동으로서 해 나가야 된다 이런 말씀을 하셨는데 여기에 대해서 인제 해답을 해 올렸습니다.,912
1070,1099,3,본회의,제19회,제83차,1954,2. 헌법개정안,장경근 의원,20,우리가 영토를 빼긴다든지 또한 주권의 제약을 받는다든지 이런 국가안위에 관한 중요사항이 있을 때 하자는 것이지 영토의 일부가 어디에 귀속되느냐 하는 문제는 아닙니다.,913
1071,1099,3,본회의,제19회,제83차,1954,2. 헌법개정안,장경근 의원,20,"아홉째로 상호안전보장…… ‘안전집단보장기구에 가입하는 것은 주권의 제약이 아니냐?’, 그렀읍니다.",914
1072,1099,3,본회의,제19회,제83차,1954,2. 헌법개정안,장경근 의원,20,6개국이 구라파방위를 위해서 군대를 다 내고 거기에 입법기관 사법기관 군대행정기관을 다 만들어 가지고 일부 각 가맹국가의 주권이 그쪽으로 이양이 되었읍니다.,915
1073,1099,3,본회의,제19회,제83차,1954,2. 헌법개정안,장경근 의원,20,불란서의 비준에 의해서 성립된다고 하면 주권의 제약을 받는 것입니다.,916
1074,1099,3,본회의,제19회,제83차,1954,2. 헌법개정안,장경근 의원,20,주권의 제약에는 해당이 됩니다.,917
1075,1099,3,본회의,제19회,제83차,1954,2. 헌법개정안,장경근 의원,20,그러나 주권에 해당되는 것은 외세의 압력에 못 이겨 하는 것이에요.,918
1076,1099,3,본회의,제19회,제83차,1954,2. 헌법개정안,장경근 의원,20,각 가맹국가의 이익을 도모하기 위하여 자진해서 하는 것이니 이것은 주권의 제약은 될지언정 국가안위에 관한 좋지 못한 영향이 없읍니다.,919
1077,1099,3,본회의,제19회,제83차,1954,2. 헌법개정안,장경근 의원,20,"세계 각국의 추세를 보드라도 주권을 양도치 못하고 제약치 못한다는 이런 국가관념에서 우리 국가관념 주권관념을 시정해 나가면서 근대국가에서는 국제사회를 옳게 해 나가려면 세계국가이라든지 국제연합을 더 강화한다든지 혹은 집단안전보장기구 같은 것을 만들어 가지고 여기에 대해서 각국이 가지고 있는 주권에 너무 고집한다고 하면 이런 기구가 활동할 수 없다, 그렇기 때문에 거기에 대해서는 이런 목적을 위해서는 주권을 또 양도하거나 제약을 하여야 된다 이러한 이론이 성립되고 서독의 헌법을 보드라도 24조 같은 데는 이런 경우에 주권을 제약하거나 양도할 수 있고 불란서 현행 헌법에도 이런 경우에는 주권을 제약할 수 있고 폴란드 헌법 같은 데도 최근에 개정해 가지고 이런 문구를 넣 것입니다.",920
1078,1099,3,본회의,제19회,제83차,1954,2. 헌법개정안,장경근 의원,20,우리의 7조의 2는 해석상으로 보드라도 주권의 제약은 해당하지만 안위에 관계된다는 그 결론에 도달하리라고 제가 해석하는 바입니다.,921
1079,1099,3,본회의,제19회,제83차,1954,2. 헌법개정안,장경근 의원,20,첫째로 주권의 제약이나 영토의 변경 등 중대한 사항이라고 국한을 했으나 주권의 제약 또는 영토의 변경을 가저올…… 이러한 ‘가저올’이라는 문구를 썼는데 현실적으로 이것은 무엇을 의미하느냐?,922
1080,1099,3,본회의,제19회,제83차,1954,2. 헌법개정안,장경근 의원,20,민주정치는 주권재민이라고 했는데 주권을 가지고 있는 국민을 믿지 못하고 민의에 최종적 결정권을 못 준다고 하면 거기서 뽑혀 온 우리 사람도 부정하는 것이고 선거제도도 부정해야 되고 또 민주정치를 부인해야 됩니다.,923
1081,1099,3,본회의,제19회,제83차,1954,2. 헌법개정안,장경근 의원,20,"이러한 것은 한편으로 국민이 직접 대(對)를 들어서 감시해야 되겠다, 주권재민이니까 주권을 가진 사람이 감시를 해야 한다는 것입니다.",924
1082,1099,3,본회의,제19회,제83차,1954,2. 헌법개정안,장경근 의원,20,"주권자인 국민은 대표자를 뽐아서 정치를 하지만 대표자를 뽑는 것 이외에 직접 국민투표제에 의해서도 주권을 행사한다, 주권을 행사하는 방법을 이렇게 병행적으로 내세웠읍니다.",925
1083,1100,3,본회의,제19회,제84차,1954,1. 헌법개정안,조재천 의원,4,"이 조항에 대한 개헌 이유는 헌법 개정은 헌법의 동일성을 파괴하지 않고 그 근본정신에 위배하지 안는 한계에 대해서만 용인되는 것이기 때문에 대한민국이 민주공화국임을 규정한 1조와 국민주권을 선언한 2조는 이 헌법 개정의 한계에서 제외해야 된다, 따라서 고칠 수 없다고 했읍니다.",926
1084,1100,3,본회의,제19회,제84차,1954,1. 헌법개정안,조재천 의원,4,"왜 그러냐 하면 헌법의 통일성을 파괴하고 근본정신을 위반한, 즉 대한민국이 민주공화국이라 하는 것을 깨트린다거나 국민이 주권자라는 것을 깨트린다는 것은 벌서 이 헌법 전체가 송두리채 없어지는 혁명을 의미하는 것입니다.",927
1085,1100,3,본회의,제19회,제84차,1954,1. 헌법개정안,조재천 의원,4,"과연 어제께 장경근 의원께서도 다른 말씀 가운데서 일종의 혁명이다, 혁명이라는 것은 우리 헌법적인 것이다, 이런 말을 하는 그 의미가 그대로 이 1조와 2조에 해당되는 것이 되어서 이러한 조문을 넣지 않는다고 하드라도 헌법 해석상 민주공화국을 규정하는, 국민주권을 선언하는 규정 이런 것은 헌법 개정을 할 수 없는 것이라는 것이 헌법 학계의 정설이 되어 가지고 있어서 이것을 안 넣드라도 당연히 해석으로 나오는 것입니다.",928
1086,1100,3,본회의,제19회,제84차,1954,1. 헌법개정안,장경근 의원,6,"하나는 행정수반인 대통령이나 국회가 이런 국가안위에 관한 중대 사항에 대해서 우리가 염려하는 바를 일을 저즐르지 않을 것이라 한다면 그런 경우에는 우리 국민도 한 목 끼어서 삼위일체로서 이 국난을 막아가는 것이 좋을 것이고, 또 하나는 국회에서 만일 이 전에 우리 선례가 있는 것과 마찬가지로 국회 푸락지 사건도 있어고 또 남북협상을 하기 위하여 정계 요인들이 월북한 일도 있으니까 혹은 이런 불순한 분자가 있을 경우도 있을지 몰으나 이런 경우에는 삼위일체가 아니라 최고의 주권을 가지고 있는 국민으로서 국회를 감시하고 견제하여야 되겠다, 이런 두 가지 작용으로 필요하다고 말씀을 드린 것입니다.",929
1087,1100,3,본회의,제19회,제84차,1954,1. 헌법개정안,장경근 의원,6,"또 한 가지는 우리가 외세의 압력에 의해서 한국의 남북총선거를 한다든지 중립화 한다 이런 문제가 나왔을 때에 어제도 말씀했읍니다만은 시위운동 이런 운동도 좋습니다마는 우리는 헌법의 절차에 의해서 국민투표의 가결을 받지 않으면 그것이 안 된다는 것이, 우리가 주권국가로 수납한다는 것이 대단히 좋은 방도입니다.",930
1088,1100,3,본회의,제19회,제84차,1954,1. 헌법개정안,장경근 의원,8,각 주에 주권이 있지만 지금 최근에 와서 미국 대통령의 힘이라는 것이 굉장히 강해졌읍니다.,931
1089,1100,3,본회의,제19회,제84차,1954,1. 헌법개정안,장경근 의원,8,우리 민주공화국이라고 하는 조문과 주권재민이라는 조문에 위반된다 이런 말씀이지만 우리가 세습의 군주로서 이 대통령을 모시자고 하는 것이 아닙니다.,932
1090,1100,3,본회의,제19회,제84차,1954,1. 헌법개정안,장경근 의원,8,우리가 민주공화국이라는 것과 주권이 백성에게 있다는 이 두 가지는 고치지 못해요.,933
1091,1101,3,본회의,제19회,제85차,1954,3. 헌법개정안,정재완 의원,15,그러나 제헌 당시부터 오늘날 이 현재까지 민국의 주권은 실지에 있어서 북한에 미치지 못하고 있읍니다.,934
1092,1101,3,본회의,제19회,제85차,1954,3. 헌법개정안,정재완 의원,15,즉 주권이 제약되어 있는 것입니다.,935
1093,1101,3,본회의,제19회,제85차,1954,3. 헌법개정안,정재완 의원,15,"이것을 또한 영토에 변경을 가져올, 또한 주권의 변경을 가져올 제약을 가져올 가장 국가 안위에 관한 중대한 사태하에 현금까지 지금까지 이 순간까지 계속적으로 그 사태하에 놓여 있는 것입니다.",936
1094,1101,3,본회의,제19회,제85차,1954,3. 헌법개정안,정재완 의원,15,호시탐탐이 침략자가 엿보고 무력으로서 우리 주권과 영토를 국민투표로서 그 무력을 방지하여 낼 도리가 있겠느냐?,937
1095,1101,3,본회의,제19회,제85차,1954,3. 헌법개정안,정재완 의원,15,국민이 우리 정부를 세워 놓고 국민이 그것을 감시하고 있는 것이고 또한 국민주권으로서 인준권을 갖이고 있는 우리 국회로서 이해득실을 잘 표현할 수 있는 것입니다.,938
1096,1101,3,본회의,제19회,제85차,1954,3. 헌법개정안,정재완 의원,15,과연 이것은 직접민주주의이며 국민주권의 구현으로 보는가?,939
1097,1101,3,본회의,제19회,제85차,1954,3. 헌법개정안,정재완 의원,15,이것은 주권의 구현으로 대통령에게 부여된 행정권이 국무원을 통해 가지고 정당하게 잘 행사되고 있는가 안 되고 있는가 이것을 한 개의 국민주권의 구현으로 구성된 국회로 하여금 그것을 감시케 하는 제도인 것입니다.,940
1098,1101,3,본회의,제19회,제85차,1954,3. 헌법개정안,정재완 의원,15,그런데 이 국무원 연대책임제를 폐지한다면 국민이 다소라도 안심하는 길을 봉쇄할 뿐만 아니라 국민주권의 구현을 제약하는 것밖에 되지 않을 것입니다.,941
1099,1101,3,본회의,제19회,제85차,1954,3. 헌법개정안,정재완 의원,15,국민주권의 구현을 주창하면서 국민주권의 구현을 제약하는 도리가 어디에 있는가?,942
1100,1101,3,본회의,제19회,제85차,1954,3. 헌법개정안,정재완 의원,15,국민주권의 구현으로서 국회를 구성해서 그 국회로서 매양 감시하도록 행정권의 정 부정을 감시하도록 하는 까닭에 곧 국민의 이해문제가 관해 가지고 있는 까닭에 국민은 이 책임제의 폐지를 요구하지 않고 있읍니다.,943
1101,1102,3,본회의,제19회,제86차,1954,2. 헌법개정안,민영남 의원,8,그런데 첫째로 개헌안 제7조2에 의하면 주권의 제약 또는 영토의 변경을 가저올 국가안위에 관한 중대 사항은 우리 국회에서 가결해 가지고서 그 가결한 조항에 한해서 국민투표에 부친다고 이렇게 했읍니다.,944
1102,1102,3,본회의,제19회,제86차,1954,2. 헌법개정안,민영남 의원,8,국민의 권리에 대한 제약을 이러한 영국의 올드미스의 영국 국민 보건과의 관계 모냥으로 연결을 맺인다고 할 것 같으면 권리의 제약이 국민주권의 제약과 연결을 맺어질 그러한 가능성이 충분히 있다고 생각합니다.,945
1103,1102,3,본회의,제19회,제86차,1954,2. 헌법개정안,민영남 의원,8,‘대한민국의 주권의 제약 또는 영토의 변경을 가지올 국가 안위에 관한 중대 사항은 국회의 가결을 거친 후에 국민투표에 부하여 민의원의원 선거권자 3분지 2 이상의 투표와 유효투표 3분지 2 이상의 찬성을 얻어야 한다’ 이렇게 되어 있읍니다.,946
1104,1102,3,본회의,제19회,제86차,1954,2. 헌법개정안,장경근 의원,10,둘째로는 영국에서는 올드미스가 고양이를 길러 가지고 고양이가 쥐를 잡고 또 소는 그 고양이를 멕이는 밀크를 생산함으로서 국가에 봉사한다 이런 예를 드시고 이 7조의2만 결국에 있어서 주권의 제약을 의미한다 이런 말씀을 하셨습니다.,947
1105,1102,3,본회의,제19회,제86차,1954,2. 헌법개정안,장경근 의원,10,이 주권의 제약이…… 그러니깐 악용하는 경우가 있으리라고 생각하는데 이것을 막을 도리가 있느냐 이런 질문이신데 제가 질문하는 요지를 못 이해했는지는 모르겠읍니다마는 이 주권의 제약이라고…… 7조의 국민투표제의 그 주권의 제약이라고 본다고 하는 것은 잘 제가 이해할 수가 없습니다.,948
1106,1102,3,본회의,제19회,제86차,1954,2. 헌법개정안,장경근 의원,10,그 주권이라는 것은 두 가지가 있는데 하나는 우리 헌법 제2조에 ‘주권은 국민에게 있다’ 하는 그 의미의 주권이라고 할 것 같으며는 이것은 주권의 도리어 확장이라고 할 수 있을 줄 생각합니다.,949
